shortcode,url,type,taken_at,timestamp,likes,comments,views,engagement_rate,caption,thumbnail
DZaFtZAFcW4,https://www.instagram.com/p/DZaFtZAFcW4/,carousel,2026-06-10T13:49:41.000Z,1781099381,173,3,,0.6029,"Esta semana, o BandInvest organizou uma conversa com Leonardo Cabral, Diretor-Executivo e Head de Investment Banking do Santander no Brasil! 💼  O evento foi uma ótima oportunidade para os alunos trocarem conhecimento com alguém que possui mais de 25 anos de experiência no mercado financeiro e que já ocupou cargos de alto escalão em empresas como Ambev e Petrobras. 📈  Os participantes fizeram perguntas e conheceram mais sobre o cotidiano de Leonardo no banco Santander, assim como seu mestrado em Stanford e o futuro do mercado financeiro. 🎓  Além disso, a palestra contou com a participação de Gabriela Bottini e Maria Luisa Nabhan, ex-alunas do Band que atuam na área de Investment Banking do Santander, enriquecendo a conversa com suas perspectivas. ✨  #ColégioBandeirantes  #BandInvest  #MercadoFinanceiro  #FuturoECarreiras  #Investimento",https://instagram.fcgh9-1.fna.fbcdn.net/v/t51.82787-15/721517044_18595020883052885_2827196915093608560_n.jpg?stp=dst-jpg_e35_tt6&_nc_cat=107&ig_cache_key=MzkxNjQ2NzMwNDAyODAzMzYyNA%3D%3D.3-ccb7-5&ccb=7-5&_nc_sid=58cdad&efg=eyJ2ZW5jb2RlX3RhZyI6IkNBUk9VU0VMX0lURU0ueHBpZHMuMTA4MC5zZHIucmVndWxhcl9waG90by5DMyJ9&_nc_ohc=yq_xjmsSwIMQ7kNvwHjY6vt&_nc_oc=Adp_C8VDwYmUegIVnChvrweP7Xn42Lkk0jPtWuF0Muz-3W3vDuysYybZd9037Vo6hlJIrASA_vkuKyNaAiGnpm0U&_nc_ad=z-m&_nc_cid=0&_nc_zt=23&_nc_ht=instagram.fcgh9-1.fna&_nc_gid=n5XBnaNgiDqmmglpG9wGrg&_nc_ss=7a22e&oh=00_Af-QxlPTLJ_W0lYf3vp5YEAYgICC3E_Z0MUOkEtzxEGr0Q&oe=6A300A51
DZYEuCnBHB8,https://www.instagram.com/p/DZYEuCnBHB8/,image,2026-06-09T19:03:54.000Z,1781031834,364,4,,1.2606,"Os irmãos e ex-alunos do Band, Su Hung-I e Su Hung-Kuan, retornaram ao Colégio após 44 anos sem vir ao Brasil para uma visita nostálgica ao lugar que marcou suas vidas! 🏫  O mais velho se formou em 1976 e seguiu estudando na Poli-USP e depois em Stanford, enquanto seu irmão, da turma de 1978 do Colégio, ingressou na University of Michigan – todas instituições mundialmente reconhecidas. 🎓  Durante a visita com os monitores do Cultural, eles destacaram que a sólida base educacional e os valores que receberam no Band foram fundamentais para as trajetórias acadêmicas e profissionais que seguiram. 🌎  Agradecemos a visita! 💙  #ColegioBandeirantes #ExAlunosBand  #ComunidadeBand #FamíliaBand #BandCosmopolita",https://instagram.fcgh9-1.fna.fbcdn.net/v/t51.82787-15/720874060_18594799027052885_6939905067875982041_n.jpg?stp=dst-jpg_e35_tt6&_nc_cat=109&ig_cache_key=MzkxNTkwMDYzMjA4MjcwNjU1Ng%3D%3D.3-ccb7-5&ccb=7-5&_nc_sid=58cdad&efg=eyJ2ZW5jb2RlX3RhZyI6IkZFRUQueHBpZHMuMTQ0MC5zZHIucmVndWxhcl9waG90by5DMyJ9&_nc_ohc=rvlu4xeVJjsQ7kNvwEAsiSD&_nc_oc=AdobXrAIDT9TvuXFBRHAgYBXeoZmJ36_9K8DydgenxN5g6xYdji0RGaQx0C5wCDIxGvaLFrxatZrbGTgpOo8CmnF&_nc_ad=z-m&_nc_cid=0&_nc_zt=23&_nc_ht=instagram.fcgh9-1.fna&_nc_gid=n5XBnaNgiDqmmglpG9wGrg&_nc_ss=7a22e&oh=00_Af-qe2811lXK7uExymxwtainAQGzARX_u7Yzmz7ScR-pHw&oe=6A301852
DZYAnvZFQ0C,https://www.instagram.com/p/DZYAnvZFQ0C/,carousel,2026-06-09T18:26:45.000Z,1781029605,82,0,,0.2809,"Maio: Imigrantes e encontros! No mês da diversidade cultural, a biblioteca do Band preparou uma programação temática sobre imigração. 🌎  Consciente do papel que povos de diferentes países ocuparam e ocupam na formação do Brasil, os encontros focaram em ler e discutir obras que abordam a cultura desses povos e sua presença no país. 🗺️  Além disso, buscamos trabalhar obras que tratam da imigração na contemporaneidade, discutindo questões como: refugiados de guerra, climáticos e imigrantes em busca de melhores condições de vida. 🤝  Também tivemos o privilégio de receber a autora e ilustradora Lúcia Hiratsuka para uma conversa com os alunos do 4.o ano, assim como o escritor Luís Eduardo Matta, recebido pelos alunos do 5.o ano. 🎨  #BandCosmopolita  #ColégioBandeirantes  #DiversidadeCultural #Colband2026 #Imigração",https://instagram.fcgh9-1.fna.fbcdn.net/v/t51.82787-15/720959680_18594791179052885_2006440968592112095_n.jpg?stp=dst-jpg_e35_tt6&_nc_cat=102&ig_cache_key=MzkxNTg4MTI5MDQ5NDYzMjEwOQ%3D%3D.3-ccb7-5&ccb=7-5&_nc_sid=58cdad&efg=eyJ2ZW5jb2RlX3RhZyI6IkNBUk9VU0VMX0lURU0ueHBpZHMuMTA4MC5zZHIucmVndWxhcl9waG90by5DMyJ9&_nc_ohc=vY5awOF7TJ8Q7kNvwGScPPw&_nc_oc=AdoQCHV4uK9Us-1drOYQJZziP2G3e-tK0B9r6Ex2NmvzocNRzShpGC7qyxaWMFXGpLMyPLbMF43gBv9afyV13MeY&_nc_ad=z-m&_nc_cid=0&_nc_zt=23&_nc_ht=instagram.fcgh9-1.fna&_nc_gid=n5XBnaNgiDqmmglpG9wGrg&_nc_ss=7a22e&oh=00_Af8k6RtPW96cGaE8yHRrdf9UXSu4cQbcMRmVt8ihRTkFMg&oe=6A30024B
DZXo1HVBd5e,https://www.instagram.com/p/DZXo1HVBd5e/,image,2026-06-09T15:00:40.000Z,1781017240,546,26,,1.9594,"Os alunos Catharina Mercaldi, Davi Rothenberg, Gustavo Luz, Luiza Dell Amore e Rafael Mayo, da 3.a série do Ensino Médio do Band, são parte do grupo Astrabrazil, que recentemente chegou na final da International Space Settlement Design Competition (ISSDC) e tornou-se a primeira equipe brasileira da história a chegar nessa fase! 🚀  Considerada a maior competição de engenharia aeroespacial do mundo, a ISSDC conta com o apoio de organizações de peso global no setor, como a agência espacial americana (Nasa). Para conquistarem seu lugar na final, os alunos desenvolveram o projeto V02, que propõe a expansão de uma colônia flutuante na atmosfera de Vênus. 🌎  Parabéns, Catharina, Davi, Gustavo, Luiza e Rafael! Estamos na torcida por vocês na fase final! 👏  Confira a matéria completa em nosso site. 🔗  #NASA #Astrabrazil #ISSDC #ColégioBandeirantes #Colband2026",https://instagram.fcgh9-1.fna.fbcdn.net/v/t51.82787-15/720434740_18594741280052885_1708730882115951101_n.jpg?stp=dst-jpg_e35_tt6&_nc_cat=105&ig_cache_key=MzkxNTc3Nzk3Mjg4MzU0NTY5NA%3D%3D.3-ccb7-5&ccb=7-5&_nc_sid=58cdad&efg=eyJ2ZW5jb2RlX3RhZyI6IkZFRUQueHBpZHMuMTQ0MC5zZHIucmVndWxhcl9waG90by5DMyJ9&_nc_ohc=tl8KFhEj6UQQ7kNvwErh6Cm&_nc_oc=AdqeRbG5_WhY87CF_53tfRaqfAIah6O9nqF4aAwtkImSAG0NYTg8_DGBgbJWnKUkmxRgcSDA5DVMT63lALfY2PUq&_nc_ad=z-m&_nc_cid=0&_nc_zt=23&_nc_ht=instagram.fcgh9-1.fna&_nc_gid=n5XBnaNgiDqmmglpG9wGrg&_nc_ss=7a22e&oh=00_Af93z3gaPzvExcpE_aWhM0H3-bPrQNK9M6kCjzFwO9FpRA&oe=6A300CFE
DZVhPARhe2F,https://www.instagram.com/p/DZVhPARhe2F/,image,2026-06-08T19:14:23.000Z,1780946063,82,1,,0.2843,"No dia 23 de maio, as educadoras Lucianne Leigue, Professora de STEAM, e Viviane Nunes, Orientadora Educacional do Fund I, representaram o Band no Encontro Regional da Rede PEA-UNESCO, realizado no Colégio Dante Alighieri, em São Paulo. 🌎  O encontro promoveu reflexões sobre temas essenciais para a educação contemporânea, como cidadania global, diversidade, educação midiática, Inteligência Artificial e direitos humanos. As palestras destacaram a importância de formar estudantes críticos, éticos e sensíveis aos desafios do mundo atual. 💡  A participação das educadoras reforça o compromisso do Colégio com uma educação voltada à formação integral e cosmopolita, à inovação pedagógica e à construção de uma sociedade mais justa, democrática e sustentável. 🤝  Leia a matéria completa em nosso site.   #BandCosmopolita #RedePEAUNESCO #CidadaniaGlobal #ColégioBandeirantes #Colband2026",https://instagram.fcgh9-1.fna.fbcdn.net/v/t51.82787-15/720611090_18594517939052885_7880018631693494433_n.jpg?stp=dst-jpg_e35_tt6&_nc_cat=102&ig_cache_key=MzkxNTE4MTYxNzY4OTUyMTU0MQ%3D%3D.3-ccb7-5&ccb=7-5&_nc_sid=58cdad&efg=eyJ2ZW5jb2RlX3RhZyI6IkZFRUQueHBpZHMuMTQ0MC5zZHIucmVndWxhcl9waG90by5DMyJ9&_nc_ohc=RhKmnHmrfFgQ7kNvwEc98-S&_nc_oc=Adqrali8rAvL97HBgx3Fjpi9IOSwfjV3yDR3pvEkvvqjVUxV1cktNBk-0m4-GOkddKH3NDQC74udoLgJC-N8zp8F&_nc_ad=z-m&_nc_cid=0&_nc_zt=23&_nc_ht=instagram.fcgh9-1.fna&_nc_gid=n5XBnaNgiDqmmglpG9wGrg&_nc_ss=7a22e&oh=00_Af_bTBYEQWmR67CHx1nEodFPNrvr6MtGRVrNaFQHfCv4hw&oe=6A301C10
DZNR3SmFh7t,https://www.instagram.com/p/DZNR3SmFh7t/,carousel,2026-06-05T14:25:46.000Z,1780669546,300,19,,1.0928,"Os integrantes da  CCA, Comunidade de Cuidado e Apoio, e suas famílias viveram uma experiência marcante no domingo, dia 31/05, visitando o Memorial do Holocausto, no bairro do Bom Retiro.  Exploramos a história por meio de fotos, documentos e réplicas que nos aproximaram de um dos períodos mais sombrios da humanidade. Tivemos também a oportunidade de ouvir o relato de Hannah Charlier, sobrevivente do Holocausto que perdeu seus pais ainda bebê. Uma história sensível e profundamente impactante.  Experiências como essa nos convocam a algo mais do que conhecer a história. Elas nos pedem que ampliemos nosso senso de humanidade, que nos tornemos mais atentos, mais empáticos, mais comprometidos com a dignidade de cada pessoa. Que reconheçamos que nenhum ser humano é superior a outro por sua origem, sua cultura, sua religião, sua aparência ou sua condição social. E que a memória das vítimas de qualquer atrocidade só é verdadeiramente honrada quando nos recusamos a repetir as lógicas que as produziram, em qualquer tempo, em qualquer lugar, sob qualquer justificativa.  O Colégio Bandeirantes, por meio da CCA, se posiciona contra qualquer símbolo, imagem ou fala que remeta ao nazismo. Não há neutralidade diante daquilo que representa assassinato, tortura e dor.  Nossos alunos e alunas partem dessa experiência com o desafio de multiplicar suas impressões e aprendizagens dentro do colégio e esperamos que, onde quer que estejam, carreguem consigo essa sensibilidade.  Obrigada a todas as famílias que acreditam e apoiam este projeto. Juntos, construímos uma cultura de paz. 🕊️ #ccaband #culturadepaz  #ProtagonismoJuvenil  #somostodocontraobullying",https://instagram.fcgh9-1.fna.fbcdn.net/v/t51.82787-15/716858542_18164963848449074_1887347554390141606_n.webp?_nc_cat=107&ig_cache_key=MzkxMjg1Njk5MzAzOTU4NzI5Nw%3D%3D.3-ccb7-5&ccb=7-5&_nc_sid=58cdad&efg=eyJ2ZW5jb2RlX3RhZyI6IkNBUk9VU0VMX0lURU0ueHBpZHMuMTQ0MC5zZHIucmVndWxhcl9waG90by5DMyJ9&_nc_ohc=ejctb2TUEugQ7kNvwHnuOqb&_nc_oc=AdopmzP6q6gcwUDo7ujVjcqVBEsa8C54aij_3zRsuNSJ9ZOQSMpdms32gIPeLG5R9kdzel3TwyFEbQe3b_QbRCbK&_nc_ad=z-m&_nc_cid=0&_nc_zt=23&_nc_ht=instagram.fcgh9-1.fna&_nc_gid=n5XBnaNgiDqmmglpG9wGrg&_nc_ss=7a22e&oh=00_Af89lYKvgWaUpTEjISGAbZhThalgyDANW7g6_L-PKewVrw&oe=6A300501
DZLGtfvkfL8,https://www.instagram.com/p/DZLGtfvkfL8/,carousel,2026-06-04T18:09:50.000Z,1780596590,624,2,,2.1444,Essas foram as estampas dos moletons de 2026! Esperamos que todos tenham gostado!,https://instagram.fcgh9-1.fna.fbcdn.net/v/t51.82787-15/717236620_18182148364386099_416432459375101846_n.jpg?stp=dst-jpg_e35_tt6&_nc_cat=104&ig_cache_key=MzkxMjI0OTcwNDkzNTA0OTAyOA%3D%3D.3-ccb7-5&ccb=7-5&_nc_sid=58cdad&efg=eyJ2ZW5jb2RlX3RhZyI6IkNBUk9VU0VMX0lURU0ueHBpZHMuMTIwMC5zZHIucmVndWxhcl9waG90by5DMyJ9&_nc_ohc=yFi-vl1suUcQ7kNvwGt7f9E&_nc_oc=AdoD9wBTYSkNXRJdiW4P-5jW9oLHpZsAwwNNx9HqHiCV-mComEqvMkUvuO9zgQlX7Kxrh8DskNxYEKJVdZ1if9GP&_nc_ad=z-m&_nc_cid=0&_nc_zt=23&_nc_ht=instagram.fcgh9-1.fna&_nc_gid=n5XBnaNgiDqmmglpG9wGrg&_nc_ss=7a22e&oh=00_Af-j--3sY0VERGZV8OFVuChXOVi5CfC_x8xwE-Jb37fS4g&oe=6A300C3B
DZIm885FY_3,https://www.instagram.com/p/DZIm885FY_3/,carousel,2026-06-03T18:53:51.000Z,1780512831,266,1,,0.9146,"A manhã de sábado foi repleta de música e dança no Band! 🎶  As famílias dos alunos do Fund I foram convidadas a participar do BandBrasil: um evento que celebra a cultura popular brasileira com base nos currículos de Música e Educação Física. 🇧🇷  Do 1.o ao 5.o ano, foram exploradas manifestações artísticas tradicionais como bumba meu boi, ciranda, coco, jongo e maculelê. E o mais legal foi ver as famílias participando das atividades e vivenciando a pluralidade cultural do Brasil de perto. 💃🏻  #Colband2026 #ColégioBandeirantes #Fundamental1 #CulturaBrasileira #CulturaPopularBrasileira",https://instagram.fcgh9-1.fna.fbcdn.net/v/t51.82787-15/713903347_18593099722052885_4573016193656052859_n.jpg?stp=dst-jpg_e35_tt6&_nc_cat=110&ig_cache_key=MzkxMTU0NzQ0NjI1MzU1MTk1Mw%3D%3D.3-ccb7-5&ccb=7-5&_nc_sid=58cdad&efg=eyJ2ZW5jb2RlX3RhZyI6IkNBUk9VU0VMX0lURU0ueHBpZHMuMTA4MC5zZHIucmVndWxhcl9waG90by5DMyJ9&_nc_ohc=JyuG-XXnoUwQ7kNvwESDrXy&_nc_oc=AdptUOPWqWUY14ne5rFKsO26tC1W-QdeH2Bsdyg6VpmxyCmMxbSVNL7uPdw7sTpzWwohZU6nkwBEyAdiOdZVD0mJ&_nc_ad=z-m&_nc_cid=0&_nc_zt=23&_nc_ht=instagram.fcgh9-1.fna&_nc_gid=n5XBnaNgiDqmmglpG9wGrg&_nc_ss=7a22e&oh=00_Af8WLzoosxDUqqNQZWS9BpTVBvQxAEM4nk-WEkzt47MOhA&oe=6A301510
DZIiBBolSNo,https://www.instagram.com/p/DZIiBBolSNo/,carousel,2026-06-03T18:10:43.000Z,1780510243,951,8,,3.2851,"Alô, galera de peão! 🤠  A Festa Junina do Terceirão aconteceu ontem e contagiou toda a comunidade Band! Além da tradicional quadrilha dos alunos da 3.a série, o Grêmio organizou a venda de correios elegantes e comidas típicas, como maçã do amor, milho verde, pipoca e muito mais. 🌽  Em parceria com a Stillo’s Formaturas, os alunos também participaram de uma competição de chute ao gol valendo uma camiseta da seleção brasileira de futebol, já entrando no clima da Copa. ⚽️  #ColégioBandeirantes #Colband2026 #FestaJunina #Comunidadeband  #climajunino",https://instagram.fcgh9-1.fna.fbcdn.net/v/t51.82787-15/713663446_18593090260052885_899346084544070622_n.jpg?stp=dst-jpg_e35_tt6&_nc_cat=105&ig_cache_key=MzkxMTUyNTQzNjQ3NTU0MjUxNQ%3D%3D.3-ccb7-5&ccb=7-5&_nc_sid=58cdad&efg=eyJ2ZW5jb2RlX3RhZyI6IkNBUk9VU0VMX0lURU0ueHBpZHMuMTA4MC5zZHIucmVndWxhcl9waG90by5DMyJ9&_nc_ohc=t7xrMC04yN0Q7kNvwGaMPO8&_nc_oc=Adp-rnbBkR8cJajeX42DYZ5Ihj4b7oimDVZpNOWQ5nqZO18o4ISJN_at5HZGTrdAufI_aqF0L0aeNMCJPMkD1CXO&_nc_ad=z-m&_nc_cid=0&_nc_zt=23&_nc_ht=instagram.fcgh9-1.fna&_nc_gid=n5XBnaNgiDqmmglpG9wGrg&_nc_ss=7a22e&oh=00_Af89U1Xz0iWLAhnYtGqfYw5336_W4hZOmhT8ON763Yy-Ng&oe=6A30218C
DZGJfySlbF6,https://www.instagram.com/p/DZGJfySlbF6/,carousel,2026-06-02T19:57:58.000Z,1780430278,74,0,,0.2535,"Na última semana, os alunos do 5.o ano do Fund I fizeram jus ao caráter cosmopolita do Band e exploraram a cidade de São Paulo! Eles foram de metrô ao Museu de Arte de São Paulo Assis Chateaubriand, o MASP, em uma saída pedagógica. 🖼️  A visita articulou os componentes curriculares de Arte e Ciências Humanas e aconteceu a partir do tema “Histórias da América Latina” e da exposição Réplica, da artista peruana Sandra Gamarra Heshiki.  Os alunos do Fund I puderam revisitar criticamente imagens coloniais e questionar as narrativas tradicionais dos museus por meio das réplicas de Gamarra, abrindo espaço para outras memórias, vozes e histórias da América Latina e contribuindo para a compreensão da importância da valorização dos saberes e identidades indígenas latino-americanas. 🌎  #MASP #BandCosmopolita  #SaídaPedagógica  #ColégioBandeirantes #Colband2026",https://instagram.fcgh9-1.fna.fbcdn.net/v/t51.82787-15/713663835_18592806058052885_1619733487173031306_n.jpg?stp=dst-jpg_e35_tt6&_nc_cat=108&ig_cache_key=MzkxMDg1NDkwMDUwMjE5MDg1Mg%3D%3D.3-ccb7-5&ccb=7-5&_nc_sid=58cdad&efg=eyJ2ZW5jb2RlX3RhZyI6IkNBUk9VU0VMX0lURU0ueHBpZHMuMTA4MC5zZHIucmVndWxhcl9waG90by5DMyJ9&_nc_ohc=-rABtScx6HUQ7kNvwHL168f&_nc_oc=AdqP-8zbbjmj5-s5LcfVG9vQnEB9LubIxXe1jrKOFqDM-s420nuKShz7X8Q52Y6lGxqBxRM4dzwrkoBrE_4WZ1no&_nc_ad=z-m&_nc_cid=0&_nc_zt=23&_nc_ht=instagram.fcgh9-1.fna&_nc_gid=6TbzW1vt7z6FlH6rl19xUw&_nc_ss=7a22e&oh=00_Af8x2oAbHqmYDyRZ0EpiUsIcSC5jjRIfyVSR-69t_m-1tw&oe=6A301D5A
DZDpXGfFTZV,https://www.instagram.com/p/DZDpXGfFTZV/,carousel,2026-06-01T20:38:41.000Z,1780346321,217,1,,0.7468,"Finalizando o ciclo, a última conversa da 3.a série com ex-alunos do Band reuniu muitas áreas: Artes, Ciências e Comunicação! 🎓  O bate-papo abordou dicas e orientações sobre escolha profissional e de universidade, além da preparação estratégica para os diferentes processos seletivos nacionais. 💡  Organizado pela área de Futuro e Carreiras, o evento foi uma oportunidade incrível para os estudantes trocarem ideias e ouvirem as experiências de quem já passou pelo vestibular. 🚀  #Colband2026 #ColégioBandeirantes #Futuroecarreiras #EuFizBand #ArtesCiênciasComunicação",https://instagram.fcgh9-1.fna.fbcdn.net/v/t51.82787-15/713643537_18592505125052885_9107580998935617870_n.jpg?stp=dst-jpg_e35_tt6&_nc_cat=103&ig_cache_key=MzkxMDE1MDc2NDYxMzc1MzY0Mw%3D%3D.3-ccb7-5&ccb=7-5&_nc_sid=58cdad&efg=eyJ2ZW5jb2RlX3RhZyI6IkNBUk9VU0VMX0lURU0ueHBpZHMuMTA4MC5zZHIucmVndWxhcl9waG90by5DMyJ9&_nc_ohc=PwNrfMcP-dgQ7kNvwGSjpwT&_nc_oc=Adrkxnv8xSHo_cTBRxpP5uC2Dy5NxIQVOvHhuZuDBQbu40WRMIqv0E9BI_M3PgFz8CVYULa_OZgfM2qPtAjc64tV&_nc_ad=z-m&_nc_cid=0&_nc_zt=23&_nc_ht=instagram.fcgh9-1.fna&_nc_gid=6TbzW1vt7z6FlH6rl19xUw&_nc_ss=7a22e&oh=00_Af-1lmgIUl7bkMn7ybU0AUp-gwxeqeWmy0if3o3kgPndFw&oe=6A300FE4
DZDkJIGhkS5,https://www.instagram.com/reel/DZDkJIGhkS5/,video,2026-06-01T19:56:01.000Z,1780343761,60,0,,0.2055,"O Tinkering & Gambiarra é uma Atividade Complementar para os 6.os e 7.os anos que mistura Arte, Ciência e Tecnologia! 🤖  Seu objetivo é proporcionar desenvolvimento de habilidades manuais e de adaptabilidade, improvisação e transformação de objetos do cotidiano. 🛠️  A produção mais recente feita pelos participantes este ano são robôs de desenhos! Veja o resultado incrível no vídeo! 🎨  #ColégioBandeirantes #Colband2026 #CiênciaeTecnologia #Habilidadesmanuais #Fundamental2",https://instagram.fcgh9-1.fna.fbcdn.net/v/t51.71878-15/712409958_2193892098101257_914881397511303892_n.jpg?stp=dst-jpg_e15_tt6&_nc_cat=109&ig_cache_key=MzkxMDEyNzg1ODMzNjgxMDE2OQ%3D%3D.3-ccb7-5&ccb=7-5&_nc_sid=58cdad&efg=eyJ2ZW5jb2RlX3RhZyI6IkNMSVBTLnhwaWRzLjY0MC5zZHIudmlkZW9fbmZyYW1lX2NvdmVyX2ZyYW1lLkMzIn0%3D&_nc_ohc=rDBsTI7EKSsQ7kNvwHCv6wL&_nc_oc=AdoJiBCdQ3mVN5Jde7AnFu6Ej9ZOxN4ayfXSPCgKuq1T0cx95jfYIEqMroakRyV9EVokiagX0dZN4IYxbstwmuXO&_nc_ad=z-m&_nc_cid=0&_nc_zt=23&_nc_ht=instagram.fcgh9-1.fna&_nc_gid=6TbzW1vt7z6FlH6rl19xUw&_nc_ss=7a22e&oh=00_Af9q3baO1SBJPPVytbiXy0gkK_aSm05MvAkIzQ95ONKdgQ&oe=6A300E3C
DZDj1NAFVHv,https://www.instagram.com/p/DZDj1NAFVHv/,carousel,2026-06-01T19:50:22.000Z,1780343422,103,0,,0.3528,"Saravá Jongueiro ✨  Ao longo das aulas de Educação Física do mês de maio, as turmas do 4.o ano estão tendo a oportunidade de conhecer uma importante manifestação da cultura popular brasileira: o Jongo. 🪘  Por meio de propostas que favorecem vivências a partir de experiências corporais, os estudantes puderam se aprofundar nas origens, nos passos básicos, nos ritmos e nas músicas que compõem a celebração desse patrimônio cultural brasileiro. 🎵  #ColégioBandeirantes  #Colband2026  #EducaçãoFísica  #CulturaBrasileira #Fundamental1",https://instagram.fcgh9-1.fna.fbcdn.net/v/t51.82787-15/713624496_18592476913052885_2690369346040107962_n.jpg?stp=dst-jpg_e35_tt6&_nc_cat=102&ig_cache_key=MzkxMDA5MzQxMjQ2NDE5MDEzNg%3D%3D.3-ccb7-5&ccb=7-5&_nc_sid=58cdad&efg=eyJ2ZW5jb2RlX3RhZyI6IkNBUk9VU0VMX0lURU0ueHBpZHMuMTA4MC5zZHIucmVndWxhcl9waG90by5DMyJ9&_nc_ohc=827QdRa8bD8Q7kNvwEgU-hh&_nc_oc=AdqWOBaxNmJhY8VVhHTNZWbGbaI5JeJVfGRHw6iz9JGH24-5Tgazj8g5SuJRJKEQxchfgLWeqw5U_tr97HTBwPZW&_nc_ad=z-m&_nc_cid=0&_nc_zt=23&_nc_ht=instagram.fcgh9-1.fna&_nc_gid=6TbzW1vt7z6FlH6rl19xUw&_nc_ss=7a22e&oh=00_Af9fLSw9JOOoL6C6OyeITkEuy9KHADn7nB7N0p7qfMUZ-w&oe=6A302751
DZDgUCKlMe5,https://www.instagram.com/p/DZDgUCKlMe5/,carousel,2026-06-01T19:19:37.000Z,1780341577,88,0,,0.3015,"Nossa CCA está crescendo!  Neste sábado, realizamos a formação dos novos integrantes eleitos dos 6º anos. Também participaram os voluntários das demais séries que passaram a integrar a equipe recentemente.  De forma lúdica e participativa, refletimos sobre os conceitos de comunidade, cuidado e apoio, a contribuição de cada integrante para o grupo e as maneiras como podemos agir diante de diferentes situações do cotidiano escolar. Os estudantes do 9º ano encenaram situações, promovendo importantes discussões sobre o papel da CCA diante desses desafios.  Nosso encontro também contou com uma participação muito especial: o Loband não resistiu ao lanche e veio acompanhar a formação!   E, claro, ele já conquistou sua pulseira da CCA! 💙✨  #ComunidadeDeCuidadoEApoio #CCA #ProtagonismoEstudantil #CuidadoEApoio #somostodoscontraobullying",https://instagram.fcgh9-1.fna.fbcdn.net/v/t51.82787-15/713763859_18164574814449074_2322795512238439790_n.webp?_nc_cat=108&ig_cache_key=MzkxMDExMDYxMjY4NDEyMjUxOQ%3D%3D.3-ccb7-5&ccb=7-5&_nc_sid=58cdad&efg=eyJ2ZW5jb2RlX3RhZyI6IkNBUk9VU0VMX0lURU0ueHBpZHMuMTQ0MC5zZHIucmVndWxhcl9waG90by5DMyJ9&_nc_ohc=KK8binpkX3wQ7kNvwGlq1hB&_nc_oc=Adp00GKxiA7phk0Wdr-ZuU78m39bH8_yL0UqmLjIusYRjFj01DGhOCi9-ZDF9WbMgZanxz6Mu7IcdfYTuimfWsKJ&_nc_ad=z-m&_nc_cid=0&_nc_zt=23&_nc_ht=instagram.fcgh9-1.fna&_nc_gid=6TbzW1vt7z6FlH6rl19xUw&_nc_ss=7a22e&oh=00_Af-kch8FJVXTkEC-6Qql-qG8zFOTR10JfUpRzkfPKVKwmA&oe=6A301E42
DY73biyhpfD,https://www.instagram.com/reel/DY73biyhpfD/,video,2026-05-29T20:08:52.000Z,1780085332,229,9,,0.8153,Registros de um dia mais que especial! 🎬  A nossa sessão exclusiva de “O Diabo Veste Prada 2” para as mães do Band foi um verdadeiro sucesso. Assista ao vídeo para conferir os melhores momentos do evento e os depoimentos de quem esteve presente. 👠  Mas não para por aí: temos muito mais relatos de mães que amaram a iniciativa! Fique ligado no nosso Insta para não perder nenhum deles. 💬  #DiaboVestePrada2 #Colband2026 #ColégioBandeirantes #FamíliaBand #DiaboVestePrada,https://instagram.fcgh9-1.fna.fbcdn.net/v/t51.71878-15/709079098_962949763193456_5030238137134259459_n.jpg?stp=dst-jpg_e15_tt6&_nc_cat=100&ig_cache_key=MzkwNzk2MDg4NzAxMjkyMzMzMQ%3D%3D.3-ccb7-5&ccb=7-5&_nc_sid=58cdad&efg=eyJ2ZW5jb2RlX3RhZyI6IkNMSVBTLnhwaWRzLjY0MC5zZHIudmlkZW9fbmZyYW1lX2NvdmVyX2ZyYW1lLkMzIn0%3D&_nc_ohc=vUpdyyiu1iQQ7kNvwFFQ8rN&_nc_oc=Ado8kMZPqX8iFTeBu6rBsnyFdqETixC9phIcsbLznMMG-Bp7fgeWnPYv37HWImi1WESG-i8umIjvEYvfKUF8tfHH&_nc_ad=z-m&_nc_cid=0&_nc_zt=23&_nc_ht=instagram.fcgh9-1.fna&_nc_gid=6TbzW1vt7z6FlH6rl19xUw&_nc_ss=7a22e&oh=00_Af9WfmCc8301Mg1LoQKfGRrLL52SALnqPtszjtEYk1azGA&oe=6A3037D5
DY7v-PphW7m,https://www.instagram.com/p/DY7v-PphW7m/,image,2026-05-29T19:03:48.000Z,1780081428,36,0,,0.1233,"Mais uma universidade internacional no Band! Recebemos a visita da EU Business School, instituição fundada em 1973 e com campi em Barcelona, Genebra e Munique. 🌍  Com alunos de mais de 130 nacionalidades, a universidade é reconhecida por seu ambiente verdadeiramente internacional e pela abordagem “learning-by-doing”, que conecta teoria e prática por meio de experiências reais de mercado.  O encontro foi uma ótima oportunidade para nossos alunos conhecerem mais sobre cursos na área de negócios, empreendedorismo e gestão em um contexto global. 🧠✨  #BandCosmopolita #Internacional  #ColégioBandeirantes  #Colband2026 #UniversidadesInternacionais",https://instagram.fcgh9-1.fna.fbcdn.net/v/t51.82787-15/709842050_18591498652052885_6104946648309317542_n.jpg?stp=dst-jpg_e35_tt6&_nc_cat=109&ig_cache_key=MzkwNzkyODA4NzI3MDM1NDY2Mg%3D%3D.3-ccb7-5&ccb=7-5&_nc_sid=58cdad&efg=eyJ2ZW5jb2RlX3RhZyI6IkZFRUQueHBpZHMuMTQ0MC5zZHIucmVndWxhcl9waG90by5DMyJ9&_nc_ohc=_dhBzRER4XIQ7kNvwHD6Isx&_nc_oc=AdpQTboM6jiij5h6QMzvwWTOOD8lfwBRVS3ijXxYO7WZOhYc-7iQi0VaGsj5xb2h9UoFjKBCd25cDn54T3Ve2vaZ&_nc_ad=z-m&_nc_cid=0&_nc_zt=23&_nc_ht=instagram.fcgh9-1.fna&_nc_gid=6TbzW1vt7z6FlH6rl19xUw&_nc_ss=7a22e&oh=00_Af8hkMru2fAKa_tz6MHwBtJYFy9PQD4ha4qziFHE7nswAA&oe=6A302401
DY7u4dOlfAs,https://www.instagram.com/p/DY7u4dOlfAs/,carousel,2026-05-29T18:53:00.000Z,1780080780,463,8,,1.6135,"Uma das nossas ex-alunas mais ilustres é a renomada autora de livros infantis Ruth Rocha. A fim de homenageá-la, renomeamos a biblioteca do Band, que agora leva o nome da escritora, em um evento especial na última sexta-feira. 📚✨  Na ocasião, recebemos seu neto, Pedro Rocha, para representá-la, a convite de Helena Aguiar, nossa Diretora de Planejamento e Integração. Em seu discurso, ele agradeceu ao Band e destacou a felicidade de sua avó com a renomeação, principalmente por se tratar de uma biblioteca – espaço que simboliza sua paixão pela literatura e pelos estudos.   Logo após a fala emocionante de Pedro, dois alunos do Colégio cortaram o laço de reinauguração do espaço, finalizando a cerimônia. 👏  Confira a matéria completa e a galeria de fotos no nosso site.  #ColégioBandeirantes #EuFizBand #RuthRocha #LivrosInfantis #Colband2026",https://instagram.fcgh9-1.fna.fbcdn.net/v/t51.82787-15/710020628_18591496366052885_142744389160497355_n.jpg?stp=dst-jpg_e35_tt6&_nc_cat=100&ig_cache_key=MzkwNzkyMzI0NTQ4MzE3ODU2OQ%3D%3D.3-ccb7-5&ccb=7-5&_nc_sid=58cdad&efg=eyJ2ZW5jb2RlX3RhZyI6IkNBUk9VU0VMX0lURU0ueHBpZHMuMTIwMC5zZHIucmVndWxhcl9waG90by5DMyJ9&_nc_ohc=sYAbtfGIyGQQ7kNvwGiueuz&_nc_oc=AdonFWly5aEgskuo9db-2gkuvbvKCLAMC0HBAGB6qHLruMbiQZ9Fmn0gKU6Zby49WcsNsMhXT_zF17M27s1lXjED&_nc_ad=z-m&_nc_cid=0&_nc_zt=23&_nc_ht=instagram.fcgh9-1.fna&_nc_gid=6TbzW1vt7z6FlH6rl19xUw&_nc_ss=7a22e&oh=00_Af-D8z6vCVG0akAtH29v0m3ssy1C7pWQewib7zzYLcnB6A&oe=6A2FFFB7
