shortcode,url,type,taken_at,timestamp,likes,comments,views,engagement_rate,caption,thumbnail
DY7FG0nhlue,https://www.instagram.com/reel/DY7FG0nhlue/,video,2026-05-29T12:55:56.000Z,1780059356,236,8,,0.8358,"Quem aí está animado para a Semana de Humanidades deste ano? As professoras Luísa e Sofia deram um spoiler para gente do que vem por aí e a programação está imperdível! 👀✨  As iniciativas têm início com o MONU-EM no sábado e seguem ao longo da próxima semana, dos dias 01 a 03 de junho.  Do Fund I ao Ensino Médio, esta edição vai discutir as violências contra a mulher, masculinidade no século XXI, o papel da mulher na sociedade, a representação do feminino nas artes e muito mais.   Vamos construir um futuro melhor juntos? 🤝  Confira a programação no site do Band: colband.net.br  #Colband2026 #ColégioBandeirantes  #SemanadeHumanidades #Feminismo #MulheresInspiradoras",https://instagram.fcgh9-1.fna.fbcdn.net/v/t51.71878-15/708451067_3935303793433295_2455645409461299129_n.jpg?stp=dst-jpg_e15_tt6&_nc_cat=110&ig_cache_key=MzkwNzczOTU2MDcyMTE0NDczNA%3D%3D.3-ccb7-5&ccb=7-5&_nc_sid=58cdad&efg=eyJ2ZW5jb2RlX3RhZyI6IkNMSVBTLnhwaWRzLjY0MC5zZHIudmlkZW9fbmZyYW1lX2NvdmVyX2ZyYW1lLkMzIn0%3D&_nc_ohc=LDGrKExWTlEQ7kNvwGKn3Hp&_nc_oc=AdrI3gjrD4rlEAhVoJG6rMX_dmGV6lZ1P1CfTXI6keZWZR7R7uQYXUq6CHUOyxxgwHLtTBNphSP4fJ9_j9UCEiBv&_nc_ad=z-m&_nc_cid=0&_nc_zt=23&_nc_ht=instagram.fcgh9-1.fna&_nc_gid=6TbzW1vt7z6FlH6rl19xUw&_nc_ss=7a22e&oh=00_Af_hBV5qWuN753iNtUpsh7F62UAtNVf2pPk1tYIz1Qb7xQ&oe=6A300F56
DY5UrxHFcCT,https://www.instagram.com/p/DY5UrxHFcCT/,carousel,2026-05-28T20:25:36.000Z,1779999936,76,1,,0.2638,"Os alunos Luís Eduardo Aoun e Kenzo Inocima subiram no pódio do 5.o Meeting de Judô da Hebraica no último final de semana! 🥋  O torneio reuniu clubes renomados dessa arte marcial, como Pinheiros, Hebraica e Paineiras, e, mesmo com adversários muito fortes, os atletas do 8.o ano do Band foram destaque na categoria sub-15.   Luís foi campeão e Kenzo levou a medalha de bronze! Parabéns, meninos! 🥇🎉🥉  #Atletas  #Judô #ColégioBandeirantes #Colband2026 #Esportes",https://instagram.fcgh9-1.fna.fbcdn.net/v/t51.82787-15/709882890_18591216418052885_5331609662365244113_n.jpg?stp=dst-jpg_e35_tt6&_nc_cat=103&ig_cache_key=MzkwNzI0NDQ0OTk2OTEyNzQ4Mg%3D%3D.3-ccb7-5&ccb=7-5&_nc_sid=58cdad&efg=eyJ2ZW5jb2RlX3RhZyI6IkNBUk9VU0VMX0lURU0ueHBpZHMuMTA4MC5zZHIucmVndWxhcl9waG90by5DMyJ9&_nc_ohc=7Zkpkc4XVR8Q7kNvwFVbuYX&_nc_oc=AdriDbklZAPtXu4thaoKAfzeLcSPjxMlUw9oFehKJjswHytxz_y6c9ZsGrCmndr0tPoVq8eYRk8c1KjLc8qDfrG4&_nc_ad=z-m&_nc_cid=0&_nc_zt=23&_nc_ht=instagram.fcgh9-1.fna&_nc_gid=6TbzW1vt7z6FlH6rl19xUw&_nc_ss=7a22e&oh=00_Af9HEbh8fbzCgU1Z9Fy3ZjypotXgfFcSikD9XUf_4EzdrQ&oe=6A300AF5
DY5HwMSFRlu,https://www.instagram.com/p/DY5HwMSFRlu/,carousel,2026-05-28T18:32:37.000Z,1779993157,115,1,,0.3974,"Nas duas últimas semanas, os alunos do 3.o ano do Fund I vivenciaram experiências enriquecedoras durante as aulas de Convivência Positiva. A partir da leitura do livro “Transformando pensamentos pessimistas em otimistas com o Leleco”, as crianças puderam refletir sobre emoções, pensamentos e formas mais assertivas de enfrentar os desafios do dia a dia. 📖✨  Como parte dessa experiência, os alunos participaram de um bate-papo muito especial com a autora da obra, Lúcia Costa, que também atua como Orientadora Educacional e de Convivência Positiva do Fund I do Band. Durante a conversa, eles compartilharam ideias, dúvidas e aprendizados sobre a importância do otimismo para o bem-estar emocional.   Mais do que “pensar positivo”, os alunos compreenderam que o otimismo está relacionado à capacidade de reconhecer os desafios e desenvolver estratégias para lidar com cada situação de forma mais saudável e esperançosa. 💙  #Colband2026 #ColégioBandeirantes  #Fundamental1  #ConvivênciaÉtica  #ConvivênciaPositiva",https://instagram.fcgh9-1.fna.fbcdn.net/v/t51.82787-15/709655242_18591185986052885_156420129423011725_n.jpg?stp=dst-jpg_e35_tt6&_nc_cat=105&ig_cache_key=MzkwNzE4NTUyNDkzODczMjY0OQ%3D%3D.3-ccb7-5&ccb=7-5&_nc_sid=58cdad&efg=eyJ2ZW5jb2RlX3RhZyI6IkNBUk9VU0VMX0lURU0ueHBpZHMuMTkyMC5zZHIucmVndWxhcl9waG90by5DMyJ9&_nc_ohc=NPacJRkn1owQ7kNvwFC4XNd&_nc_oc=AdoHBcJCAHhe3tKnnRLqJq8q4H6lIeYnRqwqZp-FN4ydExYp-LpeRvX4nNSaSD8DDKPjx3m3l1EzJsKfKfbC0Lk0&_nc_ad=z-m&_nc_cid=0&_nc_zt=23&_nc_ht=instagram.fcgh9-1.fna&_nc_gid=6TbzW1vt7z6FlH6rl19xUw&_nc_ss=7a22e&oh=00_Af_xtZk022FXZFoUiktuVsocOB288MbsalaTwP29QRsgaQ&oe=6A300F8B
DY4_hBbhYAL,https://www.instagram.com/p/DY4_hBbhYAL/,image,2026-05-28T17:25:17.000Z,1779989117,607,28,,2.1753,"Aprovada em 13 universidades americanas, incluindo a Ivy League Brown University, no prestigiado Program in Liberal Medical Education, a aluna Katrina Davis, da Turma de 2025, foi entrevistada pelo portal Terra! 🇺🇸  Na reportagem sobre seu desempenho excepcional, ela detalha sua trajetória de sucesso: teve o apoio da mãe e do Departamento Internacional, fundou a ONG Onda Sem Plástico, participou do projeto Jovens Cientistas Brasil e se engajou em Olimpíadas do Conhecimento.   Parabéns e sucesso, Katrina! Estamos muito orgulhosos de você. 🥳  Leia a matéria completa no nosso site.  #BandNaMídia #BandCosmopolita #Internacional  #Aprovações #ColégioBandeirantes",https://instagram.fcgh9-1.fna.fbcdn.net/v/t51.82787-15/709680228_18591171679052885_142667202977928408_n.jpg?stp=dst-jpg_e35_tt6&_nc_cat=110&ig_cache_key=MzkwNzE1MjAyMjk1MjMxMjg0Mw%3D%3D.3-ccb7-5&ccb=7-5&_nc_sid=58cdad&efg=eyJ2ZW5jb2RlX3RhZyI6IkZFRUQueHBpZHMuMTQ0MC5zZHIucmVndWxhcl9waG90by5DMyJ9&_nc_ohc=UEgpeXO_hM4Q7kNvwGG5FgL&_nc_oc=Adpv9jL_Xa2Xz2HNGem_WfdbOixrenARVcJU4KChhlLncHCE-a_yCeMufAgfc39SiPhTsVM1KoE8fPZTwbFjU9ZG&_nc_ad=z-m&_nc_cid=0&_nc_zt=23&_nc_ht=instagram.fcgh9-1.fna&_nc_gid=6TbzW1vt7z6FlH6rl19xUw&_nc_ss=7a22e&oh=00_Af9I375uTkuE_Enc-oPaSFc-pikzs194VSCTWFejopMw9A&oe=6A301EAA
DY2oDU9hABg,https://www.instagram.com/reel/DY2oDU9hABg/,video,2026-05-27T19:20:51.000Z,1779909651,96,2,,0.3357,"Desta vez, quem comandou o BandCast foram os membros da CCA (Comunidade de Cuidado e Apoio)! @ccaband.alunos 🤝  Eles entrevistaram Vanessa Rozan, maquiadora, apresentadora e curadora de beleza e bem-estar, para discutir sobre os padrões estéticos e seus impactos na adolescência.   Fique de olho por aqui para conferir os cortes que iremos publicar e confira o episódio completo no Spotify e na Amazon Music! O link está na Bio! 🎧  #BandCast  #ColégioBandeirantes #ColBand2026  #ProtagonismoJuvenil #ConvivênciaÉtica",https://instagram.fcgh9-1.fna.fbcdn.net/v/t51.71878-15/707477787_1416176827042502_2669142322266581601_n.jpg?stp=dst-jpg_e15_tt6&_nc_cat=107&ig_cache_key=MzkwNjQ4NTg3NzMxNjI1NTg0MA%3D%3D.3-ccb7-5&ccb=7-5&_nc_sid=58cdad&efg=eyJ2ZW5jb2RlX3RhZyI6IkNMSVBTLnhwaWRzLjY0MC5zZHIudmlkZW9fbmZyYW1lX2NvdmVyX2ZyYW1lLkMzIn0%3D&_nc_ohc=e0vT58VA7q4Q7kNvwH_Gdr1&_nc_oc=Adp_Cnj7bHIw38VyihQpqjCQYtYa-HcZOeDlenOgRBO_lzobQcpL11YtA2WTwUDR6qUeBOeRiRsNN8cGNK10O3HY&_nc_ad=z-m&_nc_cid=0&_nc_zt=23&_nc_ht=instagram.fcgh9-1.fna&_nc_gid=_8KiRK3ZSFAW_570mlLZwg&_nc_ss=7a22e&oh=00_Af_zajRFkFZY2S6CfPCdOoj5QVKDz9-aOCucmTWhegpVxg&oe=6A3006BA
DY2f0cQlaGQ,https://www.instagram.com/p/DY2f0cQlaGQ/,carousel,2026-05-27T18:05:11.000Z,1779905111,443,9,,1.5484,"Mais de 140 aceitações em cerca de 100 universidades internacionais! Esse excelente desempenho da Turma de 2025 foi celebrado em um encontro especial, que reforça o caráter cosmopolita do Band! 🅱️  O Departamento Internacional organizou o evento anual que reúne os recém-formados que foram aceitos nas melhores universidades internacionais, suas famílias e alunos do Band que planejam seguir o mesmo caminho.  Após uma série de abraços com os counselors e fotos com as flâmulas de suas respectivas faculdades, os aprovados compartilharam suas experiências no processo de aplicação, para inspirar as próximas gerações.  Parabéns a todos!! 🥳  Confira a matéria completa e a galeria de fotos no site do Band.  #BandCosmopolita #AplicaçãoInternacional  #Turma2025 #Colband2026 #ColégioBandeirantes",https://instagram.fcgh9-1.fna.fbcdn.net/v/t51.82787-15/709701012_18590865931052885_426418937582690789_n.jpg?stp=dst-jpg_e35_tt6&_nc_cat=111&ig_cache_key=MzkwNjQ0OTUyMjM0NzY0NTEzMw%3D%3D.3-ccb7-5&ccb=7-5&_nc_sid=58cdad&efg=eyJ2ZW5jb2RlX3RhZyI6IkNBUk9VU0VMX0lURU0ueHBpZHMuMTIwMC5zZHIucmVndWxhcl9waG90by5DMyJ9&_nc_ohc=d5kouK6_naEQ7kNvwHaNv4-&_nc_oc=Adq-Un-r3TWBjA0I6l3b9Z0-90wejkJCye6ha5Muu85kAm4YkS_K4zNVNXdUpIUuKRx6Vqhf2oCwKEnOkubMrXSw&_nc_ad=z-m&_nc_cid=0&_nc_zt=23&_nc_ht=instagram.fcgh9-1.fna&_nc_gid=_8KiRK3ZSFAW_570mlLZwg&_nc_ss=7a22e&oh=00_Af_c3SzxtIdVfOSxP3zdUSe-b5qvjcyP1hI-KHR3gqWOIA&oe=6A30315E
DY2LUMbldxI,https://www.instagram.com/p/DY2LUMbldxI/,carousel,2026-05-27T15:06:01.000Z,1779894361,152,5,,0.5378,"Entre os dias 20 e 24 de abril, a Professora de Inglês do Band Ana Branco foi palestrante e participou da Conferência IATEFL 2026, em Brighton, na Inglaterra – uma das conferências de profissionais do ensino da Língua Inglesa mais importantes do mundo! 👏  Ela teve a oportunidade de assistir inúmeras palestras e participar de workshops que abordaram diferentes temáticas, como: práticas de sala de aula, métodos avaliativos, Inteligência Artificial, soft skills e muitas outras.   A sua palestra, que contou com 80 participantes, apresentou o projeto desenvolvido com alunos do 6.o ano do Colégio, a partir do livro “The Boy, the Mole, the Fox and the Horse”, de Charlie Mackesy. Esse trabalho foi laureado com a certificação “Distinguished Kindness School”, tornando o Band a única escola do Brasil a conquistar esse título.   Parabéns, Ana! 🎉🅱️  #CongressoInternacional #Colband2026 #BandCosmopolita #DistinguishedKindnessSchool #ColégioBandeirantes",https://instagram.fcgh9-1.fna.fbcdn.net/v/t51.82787-15/709546108_18590819053052885_1164731944954795894_n.jpg?stp=dst-jpg_e35_tt6&_nc_cat=100&ig_cache_key=MzkwNjM1NjMxNzI0NTUyMTY3MA%3D%3D.3-ccb7-5&ccb=7-5&_nc_sid=58cdad&efg=eyJ2ZW5jb2RlX3RhZyI6IkNBUk9VU0VMX0lURU0ueHBpZHMuMTA4MC5zZHIucmVndWxhcl9waG90by5DMyJ9&_nc_ohc=u-zVhhtJRqUQ7kNvwFTtY07&_nc_oc=AdqeJlUtJ1rsiHxrwrSsHFAR0AYgK85blE-_vPKpNx_OnbLWKIFMG9iVRsd-_-RKaDCi41YMgCL7XqrbOzdvCQkr&_nc_ad=z-m&_nc_cid=0&_nc_zt=23&_nc_ht=instagram.fcgh9-1.fna&_nc_gid=_8KiRK3ZSFAW_570mlLZwg&_nc_ss=7a22e&oh=00_Af-e1WWNpmbiUfflQ7dZvfmfpPpu7-95jd-9I1QzGv0x5Q&oe=6A3003B0
DY0GdAEPpXC,https://www.instagram.com/p/DY0GdAEPpXC/,image,2026-05-26T19:45:58.000Z,1779824758,67,1,,0.2329,Os moletons estão chegando pra esquentar o colband! Em breve mais notícias…,https://instagram.fcgh9-1.fna.fbcdn.net/v/t51.82787-15/705968313_18181179895386099_807098183181956173_n.jpg?stp=dst-jpg_e35_tt6&_nc_cat=105&ig_cache_key=MzkwNTc3NTE1ODA1MjE2NTA1OA%3D%3D.3-ccb7-5&ccb=7-5&_nc_sid=58cdad&efg=eyJ2ZW5jb2RlX3RhZyI6IkZFRUQueHBpZHMuMTIwMC5zZHIucmVndWxhcl9waG90by5DMyJ9&_nc_ohc=C-_5OOJutcAQ7kNvwF3CDir&_nc_oc=Adps90VJoyXz8Mz4CmpG9yfOvsKTuaHSkGZQRsh43oI01XXpw6tlWsaqZGoBkuN-z4dvs3bjOxmmQWfUiP9H2Tnl&_nc_ad=z-m&_nc_cid=0&_nc_zt=23&_nc_ht=instagram.fcgh9-1.fna&_nc_gid=_8KiRK3ZSFAW_570mlLZwg&_nc_ss=7a22e&oh=00_Af8lw-xIm7S__FoNHzheNsVo3Od8DfZWLCIQMrNQrg_0_g&oe=6A3000F3
DY0ENzaPU1F,https://www.instagram.com/p/DY0ENzaPU1F/,image,2026-05-26T19:27:10.000Z,1779823630,70,0,,0.2398,"Alô, terceiro ano! Dia 02/06 é dia de comemorar a festa junina do band! Às 9:30, na Q1, haverá a tão esperada quadrilha! Venha trajado e não fique de fora! 🎉",https://instagram.fcgh9-1.fna.fbcdn.net/v/t51.82787-15/706089359_18181179073386099_2000752581475573049_n.jpg?stp=dst-jpg_e35_tt6&_nc_cat=103&ig_cache_key=MzkwNTc2NTMxNzU3NzM2Mjc1Nw%3D%3D.3-ccb7-5&ccb=7-5&_nc_sid=58cdad&efg=eyJ2ZW5jb2RlX3RhZyI6IkZFRUQueHBpZHMuMTM1MC5zZHIucmVndWxhcl9waG90by5DMyJ9&_nc_ohc=sVpRq9Umc6EQ7kNvwEugpGz&_nc_oc=AdrzPbK8s9hW2A_v0rpNWo-RArQGlcrlSe3Ol1hP82wRErEE22LQY04Dh0qRUV_fonNICWsy8dtEUbDjtGTeI-0u&_nc_ad=z-m&_nc_cid=0&_nc_zt=23&_nc_ht=instagram.fcgh9-1.fna&_nc_gid=_8KiRK3ZSFAW_570mlLZwg&_nc_ss=7a22e&oh=00_Af_5sPdcy6scKrXyBPJZw4ZGvkLns6RGfOB5-xr_vPTf1w&oe=6A300C4D
DY0BcObFQzU,https://www.instagram.com/p/DY0BcObFQzU/,carousel,2026-05-26T19:01:15.000Z,1779822075,105,1,,0.3631,"Para quê preciso de precisão?    Os estudantes do 2.o ano do Fund I relembraram as características dos esportes de invasão e puderam experimentar novas modalidades, como o curling. 🏐   Além de diversificar as diferentes possibilidades dos jogos de precisão, as crianças adaptaram as regras, os espaços e as formas de jogar como forma de contemplação de todas as individualidades para o bem comum. ✨  #Colband2026 #Fundamental1 #FundIColband #ColégioBandeirantes  #Esportes",https://instagram.fcgh9-1.fna.fbcdn.net/v/t51.82787-15/708517468_18590565508052885_2133032848387098240_n.jpg?stp=dst-jpg_e35_tt6&_nc_cat=109&ig_cache_key=MzkwNTc0OTM1MDc4MTE5NTEwMQ%3D%3D.3-ccb7-5&ccb=7-5&_nc_sid=58cdad&efg=eyJ2ZW5jb2RlX3RhZyI6IkNBUk9VU0VMX0lURU0ueHBpZHMuMTA4MC5zZHIucmVndWxhcl9waG90by5DMyJ9&_nc_ohc=lbA1isLJD2EQ7kNvwFyGKrC&_nc_oc=AdoYcu-9nZZnnvdwhOWEEGunPfsMO12frrNIgsXusb-ItJFTdPlHh3t3XL7_NzWAWXMcK6unkpRPSsFtkoHLk9Ne&_nc_ad=z-m&_nc_cid=0&_nc_zt=23&_nc_ht=instagram.fcgh9-1.fna&_nc_gid=_8KiRK3ZSFAW_570mlLZwg&_nc_ss=7a22e&oh=00_Af_SWXd1I_M8kev9kTmMN7RufsxLRj6dEHS50Un7Qw3Lyg&oe=6A30059B
DYzi8jgle_t,https://www.instagram.com/p/DYzi8jgle_t/,carousel,2026-05-26T14:34:47.000Z,1779806087,216,2,,0.7468,"No final de abril, tivemos as edições da Corrida Interclasses (dividida em Corrida Maluca e Corrida de Desempenho) para celebrar os excelentes resultados dos projetos da 1.a série do Ensino Médio! 🏁  Os estudantes construíram carrinhos movidos a propulsão, com base em seus conhecimentos de cinemática e aerodinâmica adquiridos nas disciplinas de STEAM e Física. Durante as aulas, eles realizaram corridas intermediárias que possibilitaram melhorias no projeto e que determinaram os convocados para o evento final.  Após a Corrida Interclasses, os carrinhos ficaram no 5.o andar para exibição desse trabalho excepcional dos alunos! 🚗  #CorridaInterclasses #STEAM #CarrinhosDeCorrida #Colband2026 #ColégioBandeirantes",https://instagram.fcgh9-1.fna.fbcdn.net/v/t51.82787-15/707079347_18590501059052885_6423116893792844983_n.jpg?stp=dst-jpg_e35_tt6&_nc_cat=109&ig_cache_key=MzkwNTYxODYzOTc3NjUxMzcyMA%3D%3D.3-ccb7-5&ccb=7-5&_nc_sid=58cdad&efg=eyJ2ZW5jb2RlX3RhZyI6IkNBUk9VU0VMX0lURU0ueHBpZHMuMTA4MC5zZHIucmVndWxhcl9waG90by5DMyJ9&_nc_ohc=y0gyfR57ESQQ7kNvwF0_bcm&_nc_oc=AdocDRcYoyqYF1FN7nDXTeMJUBb6RB102L5Ac-26Zb-RrD-8wDQNFepxkb6VSU0xlMioxvj6sYAiIPlZc7cxtXKU&_nc_ad=z-m&_nc_cid=0&_nc_zt=23&_nc_ht=instagram.fcgh9-1.fna&_nc_gid=_8KiRK3ZSFAW_570mlLZwg&_nc_ss=7a22e&oh=00_Af-W2bRoXAXe0URc7Kr08Za5JYpQCetlAuu27c-DGI2LmQ&oe=6A300C82
DYx0iRnBYiA,https://www.instagram.com/reel/DYx0iRnBYiA/,video,2026-05-25T22:37:13.000Z,1779748633,217,7,,0.7673,"“O Band que fica em mim é o Band família!” 🅱️  Além do suporte na escolha do curso e na preparação para os vestibulares, os ex-alunos Mariana Fogarin, Pedro Garbuglio e Samuel Basbaum, que participaram da conversa sobre Administração e Economia com a 3.a série, destacaram a relevância do apoio emocional da comunidade Band, vindo tanto dos professores quanto dos colegas. 💙  #Administração #Economia #EuFizBand #Colband2026 #FuturoECarreiras",https://instagram.fcgh9-1.fna.fbcdn.net/v/t51.71878-15/708333328_1505638877923995_4920395416998721742_n.jpg?stp=dst-jpg_e15_tt6&_nc_cat=107&ig_cache_key=MzkwNTEzMzQwNTY5NjAwMjE3Ng%3D%3D.3-ccb7-5&ccb=7-5&_nc_sid=58cdad&efg=eyJ2ZW5jb2RlX3RhZyI6IkNMSVBTLnhwaWRzLjY0MC5zZHIudmlkZW9fbmZyYW1lX2NvdmVyX2ZyYW1lLkMzIn0%3D&_nc_ohc=99ayJ7nFyl4Q7kNvwFFM_Oq&_nc_oc=Adoyu-lqYz4P7pxGueAVfy6VHh5LTLiQyh24i_QI5VswIuVFaSda2awIglNiNWHKnOIf4TQxf1x-dEhcu5kooSJy&_nc_ad=z-m&_nc_cid=0&_nc_zt=23&_nc_ht=instagram.fcgh9-1.fna&_nc_gid=_8KiRK3ZSFAW_570mlLZwg&_nc_ss=7a22e&oh=00_Af8U_5S9uozaK_aMy2d7IcVs5Y8UYMt-F6sVKZQzM9wQnA&oe=6A302DD6
DYxc-rylfGw,https://www.instagram.com/p/DYxc-rylfGw/,carousel,2026-05-25T19:04:10.000Z,1779735850,131,3,,0.459,"No dia 15 de maio, abrimos as portas da sala de aula para receber as famílias do 1.o ano em nossa tão esperada Jogomática!   Durante o encontro, as crianças compartilharam com seus familiares alguns dos jogos vivenciados nas aulas de Matemática, assumindo o papel de quem ensina e compartilha descobertas.   Foi um momento muito especial, repleto de aprendizagem, trocas e diversão, fortalecendo ainda mais a parceria entre escola e família. Acompanhem alguns registros desse encontro tão significativo! 💛  #Colband2026 #Fundamental1 #Matemática  #ColégioBandeirantes  #FundIColband",https://instagram.fcgh9-1.fna.fbcdn.net/v/t51.82787-15/707097647_18590272120052885_8473350913685847036_n.jpg?stp=dst-jpg_e35_tt6&_nc_cat=105&ig_cache_key=MzkwNTAyODIxODEyMTc2NjI1OA%3D%3D.3-ccb7-5&ccb=7-5&_nc_sid=58cdad&efg=eyJ2ZW5jb2RlX3RhZyI6IkNBUk9VU0VMX0lURU0ueHBpZHMuMTA4MC5zZHIucmVndWxhcl9waG90by5DMyJ9&_nc_ohc=GaU5Jo_Ml4wQ7kNvwFEnMOa&_nc_oc=AdqB4LsAHmmise9RYj8V5sY2SXiNxQJS651zqkekSnE2usQDIw6LiByvRYh0Yk1BOAsHIjqFScqAVudRJ5PdfCbr&_nc_ad=z-m&_nc_cid=0&_nc_zt=23&_nc_ht=instagram.fcgh9-1.fna&_nc_gid=_8KiRK3ZSFAW_570mlLZwg&_nc_ss=7a22e&oh=00_Af-EviCFdqcJT2y4pOxth_hFu0OPIt5e-cbnaa_e0aottA&oe=6A300673
DYxFumDlbIS,https://www.instagram.com/p/DYxFumDlbIS/,carousel,2026-05-25T15:41:00.000Z,1779723660,453,7,,1.5758,"Pedro Haddad é aluno da 3.a série do Ensino Médio do Band e atleta federado no hipismo, tendo acumulado vários títulos ao longo da sua trajetória! 👏  Recentemente ele participou do Campeonato Nacional de Salto, no Clube Hípica Santo Amaro, com outros 76 participantes. Na ocasião, ele consagrou-se campeão geral na categoria Jovem Cavaleiro A (com obstáculos de 1.10 metros) do CSN5* D’Maio, uma das principais competições de hipismo de salto do Brasil.  Parabéns, Pedro!!! Boa sorte nos próximos campeonatos.  #Colband2026  #ColégioBandeirantes  #Atletas  #Hipismo",https://instagram.fcgh9-1.fna.fbcdn.net/v/t51.82787-15/706981923_18590218399052885_2688681026646917150_n.jpg?stp=dst-jpg_e35_tt6&_nc_cat=104&ig_cache_key=MzkwNDkyNzAxODA0NzA1MzczNw%3D%3D.3-ccb7-5&ccb=7-5&_nc_sid=58cdad&efg=eyJ2ZW5jb2RlX3RhZyI6IkNBUk9VU0VMX0lURU0ueHBpZHMuMTI4MC5zZHIucmVndWxhcl9waG90by5DMyJ9&_nc_ohc=awZF74g2QfEQ7kNvwGKC8C3&_nc_oc=AdpAYJAXLfcI5HW7aQVYmCQUwhBgBGHfBBM8fiK6CWziH0aKi6ZWUqzrKi4lXMX7IzEs6dJ-otgRNIERXQxspJc2&_nc_ad=z-m&_nc_cid=0&_nc_zt=23&_nc_ht=instagram.fcgh9-1.fna&_nc_gid=_8KiRK3ZSFAW_570mlLZwg&_nc_ss=7a22e&oh=00_Af-WPJ-VaBUzP26_UqKBk1PSC04ljnmuaNFgqTt4P8XjWw&oe=6A30246B
DYp3psUlSbB,https://www.instagram.com/p/DYp3psUlSbB/,carousel,2026-05-22T20:23:18.000Z,1779481398,556,46,,2.0622,"150 vezes campeão! 👏  O Professor Paulo Godoi alcançou a impressionante marca de 150 títulos como técnico de basquete do Band!  Ele iniciou este trabalho no Colégio em 1997 e, desde então, vem colecionando troféus que são fruto de seu esforço e dedicação, do apoio do Band ao esporte e do empenho brilhante dos nossos alunos-atletas.  Obrigada por tudo, Paulão! Que venham muito mais títulos e anos de história vestindo a camisa do Band!  #FamíliaBand #Atletas #EsporteColband #Colband2026  #BasqueteColband",https://instagram.fcgh9-1.fna.fbcdn.net/v/t51.82787-15/703924205_18589360360052885_1907937044011300884_n.jpg?stp=dst-jpg_e35_tt6&_nc_cat=110&ig_cache_key=MzkwMjg5NDI2Mzk4MTUyMDE0OQ%3D%3D.3-ccb7-5&ccb=7-5&_nc_sid=58cdad&efg=eyJ2ZW5jb2RlX3RhZyI6IkNBUk9VU0VMX0lURU0ueHBpZHMuNzU1LnNkci5yZWd1bGFyX3Bob3RvLkMzIn0%3D&_nc_ohc=UX5tEJ1TTcQQ7kNvwH3savM&_nc_oc=AdrW7PaPLTMp6k40yh77SmxzW7GVMqnyPUsy-v9Ynf5LJ38urtpdRwqWnL0aC5gAPjsX1sLc8AWMNLMLruXe6fze&_nc_ad=z-m&_nc_cid=0&_nc_zt=23&_nc_ht=instagram.fcgh9-1.fna&_nc_gid=_8KiRK3ZSFAW_570mlLZwg&_nc_ss=7a22e&oh=00_Af-cq4e_jxU4Cq-A_Qxk_4jRHY63zfqn3J71BsA_4uPPPw&oe=6A303651
DYpuimeFWtg,https://www.instagram.com/p/DYpuimeFWtg/,carousel,2026-05-22T19:03:42.000Z,1779476622,251,1,,0.8633,"Essa semana, o Band recebeu representantes de algumas das universidades mais seletivas e prestigiadas dos Estados Unidos! 🇺🇸✨  Tivemos uma feira com Princeton University, Dartmouth College, Duke University, Georgetown University, Northwestern University e Vanderbilt University, além de uma visita individual da University of Chicago — todas Top 20 universidades dos EUA.  Foi uma oportunidade incrível para nossos alunos conhecerem mais sobre diferentes possibilidades internacionais. 🌎  Você sabia que o Band já teve alunos aprovados em todas elas e que a Debbie, Coordenadora do Internacional, fez sua graduação na University of Chicago? 🐦‍🔥   #BandCosmopolita  #CollegeCounseling  #FutureReady  #InternationalEducation",https://instagram.fcgh9-1.fna.fbcdn.net/v/t51.82787-15/703914999_18589340293052885_4982726753915075412_n.jpg?stp=dst-jpg_e35_tt6&_nc_cat=100&ig_cache_key=MzkwMjg1Mzk2MTY0NDEwNjcxOA%3D%3D.3-ccb7-5&ccb=7-5&_nc_sid=58cdad&efg=eyJ2ZW5jb2RlX3RhZyI6IkNBUk9VU0VMX0lURU0ueHBpZHMuMTA4MC5zZHIucmVndWxhcl9waG90by5DMyJ9&_nc_ohc=WVVOtZD-IlAQ7kNvwFF4rKz&_nc_oc=Adrf8D9-fBuEQRgi8LxtLMUGyPMQtlII-_ICVe_CcveLIurWzy9fBxZAKm-vpjK0rnmOrTs2TNmc9gOhmYCpT3d3&_nc_ad=z-m&_nc_cid=0&_nc_zt=23&_nc_ht=instagram.fcgh9-1.fna&_nc_gid=_8KiRK3ZSFAW_570mlLZwg&_nc_ss=7a22e&oh=00_Af8yUySuIIDgk4fIMSlBmc3FxOqXs7IuzjMLY50HRYLaxQ&oe=6A30094A
DYpl8xPlax0,https://www.instagram.com/p/DYpl8xPlax0/,carousel,2026-05-22T17:48:37.000Z,1779472117,241,3,,0.8358,"Aprender colocando a mão na massa é muito mais divertido e significativo!   Ao longo do 1.o trimestre, os alunos do 4.o ano investigaram o fenômeno da decomposição, refletindo sobre as transformações que acontecem ao longo do tempo em materiais orgânicos e inorgânicos por meio de diferentes experimentos. Nesse percurso, compreenderam que a ação de micro-organismos decompositores acelera esse processo.   Já no 2.o trimestre, a investigação continua: onde mais os micro-organismos estão presentes no nosso cotidiano?   Para explorar essa questão, os alunos participaram de uma oficina de pão de fermentação natural com o padeiro Marcelo, da padaria @entaopao, que fica aqui no bairro da Vila Mariana. Durante a experiência, refletiram sobre as transformações que acontecem no processo da produção do pão.   E, claro, finalizaram a atividade da melhor forma: saboreando um pão delicioso!  #Colband2026  #ColégioBandeirantes #FundIColband",https://instagram.fcgh9-1.fna.fbcdn.net/v/t51.82787-15/703896709_18589322827052885_574619828145527753_n.jpg?stp=dst-jpg_e35_tt6&_nc_cat=105&ig_cache_key=MzkwMjgxNjI0OTQ3NDA5NDk5OQ%3D%3D.3-ccb7-5&ccb=7-5&_nc_sid=58cdad&efg=eyJ2ZW5jb2RlX3RhZyI6IkNBUk9VU0VMX0lURU0ueHBpZHMuMTA4MC5zZHIucmVndWxhcl9waG90by5DMyJ9&_nc_ohc=dxNt3W5nCkUQ7kNvwGqXYNt&_nc_oc=AdqmExX5-GvXmg3-QvLAiIbrdLGMUtpRoiw_29i0wfjp-04PDpj8VSlKCQhxUStjdJnnv6rc6btIdil6GCgMLOOb&_nc_ad=z-m&_nc_cid=0&_nc_zt=23&_nc_ht=instagram.fcgh9-1.fna&_nc_gid=qiA_AZGOJ3ML9odJJtY3qA&_nc_ss=7a22e&oh=00_Af_8HfqJmbLWekuvPlEdy7vbw2BidBrvKgfSR54iixiXSA&oe=6A30031E
DYnX9KqlYdF,https://www.instagram.com/p/DYnX9KqlYdF/,carousel,2026-05-21T21:07:52.000Z,1779397672,257,13,,0.9249,"Na manhã do último domingo, o Cultural organizou um evento exclusivo para as mães, que contou com uma conversa sobre mercado de luxo e uma sessão especial no Shopping Iguatemi da sequência de um dos filmes mais icônicos de todos os tempos: “O Diabo Veste Prada 2”. 🎥👠  A convite de Helena Aguiar, Diretora de Planejamento e Integração do Colégio, a ex-aluna do Band e atual Country Manager da Bottega Veneta no Brasil Andrezza Mastiguim conversou com o público sobre sua trajetória no mercado da moda e as transformações desse setor antes de iniciar a exibição.   Após o mini talk, as convidadas assistiram ao vídeo do Dia dos Bixos e ao filme, que debateu as dinâmicas da indústria da moda. Elas puderam aproveitar a ocasião para se integrar com outras mães e curtir uma experiência cultural enriquecedora!  #ODiaboVestePrada2  #MercadoDeLuxo  #Cinema #CulturalColband #Colband2026",https://instagram.fcgh9-1.fna.fbcdn.net/v/t51.82787-15/703275703_18589075675052885_5107829649792346627_n.jpg?stp=dst-jpg_e35_tt6&_nc_cat=111&ig_cache_key=MzkwMjE5MjQ2ODcxNjAzNTk0Mg%3D%3D.3-ccb7-5&ccb=7-5&_nc_sid=58cdad&efg=eyJ2ZW5jb2RlX3RhZyI6IkNBUk9VU0VMX0lURU0ueHBpZHMuMTA4MC5zZHIucmVndWxhcl9waG90by5DMyJ9&_nc_ohc=_UwTmTwmpRAQ7kNvwECPfkG&_nc_oc=Adqsgsfjf02XlQi5DMsPAxVi-qzr0CnU6TH0NXn-UNHiiWAiFDi1qXiEmYkqa5X_3Wv3C5gUaW0bI45xTHjL6rW8&_nc_ad=z-m&_nc_cid=0&_nc_zt=23&_nc_ht=instagram.fcgh9-1.fna&_nc_gid=qiA_AZGOJ3ML9odJJtY3qA&_nc_ss=7a22e&oh=00_Af9cwbtSu4tldXSn2T_E3hKxutL6YtDGdbL_ZfJrTcjfQg&oe=6A3009B9
