shortcode,url,type,taken_at,timestamp,likes,comments,views,engagement_rate,caption,thumbnail
DYnI5GOB85e,https://www.instagram.com/p/DYnI5GOB85e/,image,2026-05-21T18:56:20.000Z,1779389780,80,2,,0.2809,"Ano letivo 2027 - ALUNOS NOVOS – 1.a série do Ensino Médio 🅱️  📣 Atenção: dia 09/06, terça-feira, das 16:00 às 18:00, tem o Encontro com a equipe pedagógica do Ensino Médio.  🏫 A apresentação abordará a matriz curricular, orientação educacional, convivência positiva, aulas eletivas, atividades complementares, orientação para os processos seletivos nacionais e internacionais, esportes, entre outros assuntos.  ➡️ Para participar, entre no site do Band e clique no destaque “Encontro com Ensino Médio “, ou, acesse o link do evento na bio. 😉  ⚠️ As vagas são limitadas! Inscrições até 01/06 ou até o preenchimento das vagas.  ☎️ (11) 5087-3500 📧 secretaria@colband.com.br  #EncontroComOEnsinoMédio #EnsinoMédioColband #Matrículas2027 #ColégioBandeirantes #Colband2026",https://instagram.fcgh9-1.fna.fbcdn.net/v/t51.82787-15/702676405_18589045450052885_5063195332281693642_n.jpg?stp=dst-jpg_e35_tt6&_nc_cat=108&ig_cache_key=MzkwMjEyNjcxMDE5OTkzMDQ2Mg%3D%3D.3-ccb7-5&ccb=7-5&_nc_sid=58cdad&efg=eyJ2ZW5jb2RlX3RhZyI6IkZFRUQueHBpZHMuMTQ0MC5zZHIucmVndWxhcl9waG90by5DMyJ9&_nc_ohc=gnb5ktlyzSsQ7kNvwFFgbTt&_nc_oc=AdrC3wZwJUfsw6xN_obItE9s72DQ_SCrdHhDD6AbRcE-mmg1ADKXqDDzx7W7v_7qJmdheFk4mkhACe4VEcd7Hmc8&_nc_ad=z-m&_nc_cid=0&_nc_zt=23&_nc_ht=instagram.fcgh9-1.fna&_nc_gid=qiA_AZGOJ3ML9odJJtY3qA&_nc_ss=7a22e&oh=00_Af8hso-B7P90D5Jj9MbJ0Pt_Ki1j7ZZIZV0q7NFi3m7_Yw&oe=6A300CD5
DYnHkP8Ba59,https://www.instagram.com/p/DYnHkP8Ba59/,image,2026-05-21T18:44:55.000Z,1779389095,78,0,,0.2672,"Ano letivo 2027 - ALUNOS NOVOS - Ensino Fundamental II 🅱️   📣 Atenção: dia 08/06, segunda-feira, das 16:00 às 18:00, tem o Encontro com a equipe pedagógica do Fund II (6º, 7º, 8º e 9º ano).   🏫 A apresentação abordará a matriz curricular, orientação educacional, convivência positiva, atividades complementares, esportes, viagens pedagógicas, entre outros assuntos.   ➡️ Para participar, entre no site do Band e clique no destaque “Encontro com o Fund II “, ou, acesse o link do evento na bio. 😉  ⚠️ As vagas são limitadas! Inscrições até 01/06 ou até o preenchimento das vagas.  ☎️ (11) 5087-3500 📧 secretaria@colband.com.br   @schooladvisorbr  #EncontroComOFund2 #Fund2Colband #Matrículas2027 #ColégioBandeirantes #Colband2026",https://instagram.fcgh9-1.fna.fbcdn.net/v/t51.82787-15/705420722_18589043545052885_8510059494679892615_n.jpg?stp=dst-jpg_e35_tt6&_nc_cat=108&ig_cache_key=MzkwMjEyMDg3OTQ3OTY5NzAyMQ%3D%3D.3-ccb7-5&ccb=7-5&_nc_sid=58cdad&efg=eyJ2ZW5jb2RlX3RhZyI6IkZFRUQueHBpZHMuMTQ0MC5zZHIucmVndWxhcl9waG90by5DMyJ9&_nc_ohc=ALIfv5IwN3QQ7kNvwFOS6Kr&_nc_oc=Adq4aN96q6yLVZbdiQW8_PZSqfDW1hRIrG8xVRWhF-839nXUgY-iBDN6TQHvPWsfqha7ii7_qGrSn-k0sC17Zgit&_nc_ad=z-m&_nc_cid=0&_nc_zt=23&_nc_ht=instagram.fcgh9-1.fna&_nc_gid=qiA_AZGOJ3ML9odJJtY3qA&_nc_ss=7a22e&oh=00_Af8M41S0Kwjrlcyk1o8qHoqS1KFNyK2JxSmMZDdzGPZyQA&oe=6A3016E7
DYmkXrulVKU,https://www.instagram.com/p/DYmkXrulVKU/,carousel,2026-05-21T13:37:06.000Z,1779370626,144,1,,0.4967,"O Band tá Prompt! 🛜💻🅱️  No dia 13 de maio, a Equipe de Tecnologia organizou uma ativação que celebrou a parceria entre o Band e o Google! Essa colaboração amplia o acesso dos nossos educadores às ferramentas de Inteligência Artificial por meio do Google AI Pro.  Ao longo do dia, eles puderam: ✅ Conhecer mais sobre as ferramentas de IA do Gemini, ✅ Tirar fotos profissionais em grupo com colegas, ✅ Recriar essas fotos usando o Gemini.  Através das ferramentas do Gemini, os nossos mascotes LoBand, LoBandinho e Lobot viajaram no tempo desde a época medieval até a era dos karaokês futuristas. Veja os resultados! 🐺  #Gemini  #GoogleAiPro  #TecnologiaColband #IAnasEscolas #Colband2026",https://instagram.fcgh9-1.fna.fbcdn.net/v/t51.82787-15/702525266_18588968977052885_5625131999810943345_n.jpg?stp=dst-jpg_e35_tt6&_nc_cat=103&ig_cache_key=MzkwMTk2NTQxNDMyMTk0MDU5OQ%3D%3D.3-ccb7-5&ccb=7-5&_nc_sid=58cdad&efg=eyJ2ZW5jb2RlX3RhZyI6IkNBUk9VU0VMX0lURU0ueHBpZHMuMTEwOC5zZHIucmVndWxhcl9waG90by5DMiJ9&_nc_ohc=0xlVwzdV8P4Q7kNvwE_RGZy&_nc_oc=Adp-Annwx-u-wd2gjXqUcsnftqC5BP89xlzzFwccjSUSSO7lMsSbPXcolWTM3_cjGWUeOq-0lvPtx_BIkE38AtFP&_nc_ad=z-m&_nc_cid=0&_nc_zt=23&_nc_ht=instagram.fcgh9-1.fna&_nc_gid=qiA_AZGOJ3ML9odJJtY3qA&_nc_ss=7a22e&oh=00_Af8hBLtsJWw6C1Zw8566KPtkd3uAJgiYjr9sKhwbYCwaaA&oe=6A30081C
DYkdE9dBfsJ,https://www.instagram.com/reel/DYkdE9dBfsJ/,video,2026-05-20T17:56:07.000Z,1779299767,322,5,,1.1202,"Os abraços dizem muito, sejam eles de reencontro, de conquista ou de gratidão. 🤗✨  No Dia dos Bixos, cada abraço carrega uma história e uma emoção! Entre sorrisos, lágrimas e celebrações, o gesto simboliza todos os laços construídos ao longo dos anos no Band. 💛🎓  #DiaDosBixos #AprovadosColband  #Vestibular2026 #ColégioBandeirantes #Colband2026",https://instagram.fcgh9-1.fna.fbcdn.net/v/t51.71878-15/703988405_1568445828179404_3996178601700924681_n.jpg?stp=dst-jpg_e15_tt6&_nc_cat=101&ig_cache_key=MzkwMTM3MTA2MTQyMTYwMzU5Mw%3D%3D.3-ccb7-5&ccb=7-5&_nc_sid=58cdad&efg=eyJ2ZW5jb2RlX3RhZyI6IkNMSVBTLnhwaWRzLjY0MC5zZHIudmlkZW9fbmZyYW1lX2NvdmVyX2ZyYW1lLkMzIn0%3D&_nc_ohc=q3p_LXPE2t0Q7kNvwHsEl5z&_nc_oc=AdqZrbXhLUFKE8-0ECz-gT3CgfNZV2DI-WOCnAJrJ954Lu0CyOuJA0UvsR3Cs60zA3xgQtC1zt-4aIyAOk1pXE5M&_nc_ad=z-m&_nc_cid=0&_nc_zt=23&_nc_ht=instagram.fcgh9-1.fna&_nc_gid=qiA_AZGOJ3ML9odJJtY3qA&_nc_ss=7a22e&oh=00_Af9k0s_vDhBWUjGF5gDm6jTc-oZcVpyUl8WrF2_IJzTZow&oe=6A302F67
DYh81eaBM6X,https://www.instagram.com/reel/DYh81eaBM6X/,video,2026-05-19T18:35:56.000Z,1779215756,653,13,,2.2814,"⚽️ O clima de Copa do Mundo já começou por aqui! 2026 chegou e, claro, os alunos já estão colecionando as figurinhas para completar o álbum!  🇧🇷🏆  Você sabia que essa febre vai muito além de um simples passatempo? Ela também é uma forma de se enturmar, negociar e aprender a lidar com frustrações.   Assista ao vídeo e conheça alguns dos benefícios de completar o álbum! 🤩",https://instagram.fcgh9-1.fna.fbcdn.net/v/t51.71878-15/702830040_1308732001370153_8727745295246470051_n.jpg?stp=dst-jpg_e15_tt6&_nc_cat=111&ig_cache_key=MzkwMDY2NjMwOTg1MTI3MDgwNw%3D%3D.3-ccb7-5&ccb=7-5&_nc_sid=58cdad&efg=eyJ2ZW5jb2RlX3RhZyI6IkNMSVBTLnhwaWRzLjY0MC5zZHIudmlkZW9fbmZyYW1lX2NvdmVyX2ZyYW1lLkMzIn0%3D&_nc_ohc=PBSnwFKWjwwQ7kNvwFFTl8L&_nc_oc=Adq5X9aeAi1OaeEOPDRII05I2qe1pmzNOXczXYqjp3jO1Ocl-ku8wMxVP8bw8eeoJrOc7fRGx8ZeQGwgqe_kTJds&_nc_ad=z-m&_nc_cid=0&_nc_zt=23&_nc_ht=instagram.fcgh9-1.fna&_nc_gid=qiA_AZGOJ3ML9odJJtY3qA&_nc_ss=7a22e&oh=00_Af_x88gD15Ue71TZgK7Xwuh_VIDljOkV2iXvIXExc_FUfg&oe=6A302181
DYh02xYFevf,https://www.instagram.com/p/DYh02xYFevf/,carousel,2026-05-19T17:24:57.000Z,1779211497,99,0,,0.3391,"Aprendizado em movimento! 🥁  As aulas de música do 2.o trimestre do 5.o ano são dedicadas ao estudo do Maculelê, manifestação cultural brasileira que provoca o movimento e desperta diversos sentidos dos envolvidos.   As vivências com o Maculelê permitem que os estudantes utilizem o corpo como um todo no processo de aprendizagem. O estudo sobre as origens dessa prática cultural e os agentes envolvidos em sua preservação, o ritmo do Congo de Ouro de origem nas religiões afrobrasileiras, o canto e a prática com os movimentos que simulam uma batalha, fazem parte da experiência com o Maculelê.   Todos esses estudos serão compartilhados com a nossa comunidade durante o BandBrasil, evento que celebra diversas manifestações da cultura brasileira, no final de maio!  #Maculelê  #Música  #FundIColband  #ColégioBandeirantes  #Colband2026",https://instagram.fcgh9-1.fna.fbcdn.net/v/t51.82787-15/702650546_18588441673052885_7854929484747492524_n.jpg?stp=dst-jpg_e35_tt6&_nc_cat=103&ig_cache_key=MzkwMDYzMDc0OTI3NTI2MzIzNQ%3D%3D.3-ccb7-5&ccb=7-5&_nc_sid=58cdad&efg=eyJ2ZW5jb2RlX3RhZyI6IkNBUk9VU0VMX0lURU0ueHBpZHMuMTA4MC5zZHIucmVndWxhcl9waG90by5DMyJ9&_nc_ohc=sccmh22R06wQ7kNvwH7gvfS&_nc_oc=AdpQWTbZ_4Y8NdJ9JkJv_19e8Fo64b1F18Nxr6on5NdbQYvsjOpcbeypWRS8CS3_K6qL_jmr5kYK56XrgPWsmZ4O&_nc_ad=z-m&_nc_cid=0&_nc_zt=23&_nc_ht=instagram.fcgh9-1.fna&_nc_gid=qiA_AZGOJ3ML9odJJtY3qA&_nc_ss=7a22e&oh=00_Af9a_5-KUQ8pHsEGKg6vIhwCY6k7LfxLqi4ClVCY1LEzOQ&oe=6A302915
DYhz7rdBV6O,https://www.instagram.com/p/DYhz7rdBV6O/,image,2026-05-19T17:17:19.000Z,1779211039,52,0,,0.1781,"Venha fazer parte do nosso time! 🅱️  Para mais informações, acesse a página do Colégio Bandeirantes no Linkedin.💻  #TimeBand  #TimeColband #ProcessoSeletivo #ColégioBandeirantes  #Colband2026",https://instagram.fcgh9-1.fna.fbcdn.net/v/t51.82787-15/702176731_18588439378052885_7272447285431173785_n.jpg?stp=dst-jpg_e35_tt6&_nc_cat=111&ig_cache_key=MzkwMDYyNzE1Mzc1ODU0MzUwMg%3D%3D.3-ccb7-5&ccb=7-5&_nc_sid=58cdad&efg=eyJ2ZW5jb2RlX3RhZyI6IkZFRUQueHBpZHMuMTQ0MC5zZHIucmVndWxhcl9waG90by5DMyJ9&_nc_ohc=wjLWB-oRtSIQ7kNvwHYA8eu&_nc_oc=AdqtKM0Li0c_o1xelp64tslHfiZ8bfqWWu7KvD2KkjIPIr4RORDYeHacTosFZsRrD_XswC1DS4I7YkkW62qwaMdt&_nc_ad=z-m&_nc_cid=0&_nc_zt=23&_nc_ht=instagram.fcgh9-1.fna&_nc_gid=qiA_AZGOJ3ML9odJJtY3qA&_nc_ss=7a22e&oh=00_Af_wVh3a8evi-knlUAnz2s4nRD8QUhYGY65dsDdXgPYY-w&oe=6A300C48
DYfkWsXFWkr,https://www.instagram.com/p/DYfkWsXFWkr/,carousel,2026-05-18T20:22:17.000Z,1779135737,98,0,,0.3357,"A comunidade Band esteve presente no Shrek – O Musical, no Teatro Renault, em uma tarde de sábado organizada pelo Departamento Cultural! 🎭  As famílias e os educadores do Colégio puderam aproveitar o espetáculo que dá vida ao ogro mais amado do planeta e conta com um elenco de peso. 💚  Entre risadas, aventuras e músicas, a peça conquistou o público! 🎼  #ShrekOMusical #TeatroRenault #CulturalColband #ColégioBandeirantes #Colband2026",https://instagram.fcgh9-1.fna.fbcdn.net/v/t51.82787-15/702162288_18588190720052885_1204031577790175751_n.jpg?stp=dst-jpg_e35_tt6&_nc_cat=102&ig_cache_key=Mzg5OTk5NDg3Njg2NzQ1MTc3OA%3D%3D.3-ccb7-5&ccb=7-5&_nc_sid=58cdad&efg=eyJ2ZW5jb2RlX3RhZyI6IkNBUk9VU0VMX0lURU0ueHBpZHMuMTA4MC5zZHIucmVndWxhcl9waG90by5DMyJ9&_nc_ohc=wkMh2KXDFlcQ7kNvwHGsaiQ&_nc_oc=Adqa3d3nj9ZPcjoT9gsSFwm0ue2z9RJvW0WU-U1gXZkZnEncxsnv0IfT5hVavu2qhE0Nbx0gzqEKFw5L8xskVFVm&_nc_ad=z-m&_nc_cid=0&_nc_zt=23&_nc_ht=instagram.fcgh9-1.fna&_nc_gid=qiA_AZGOJ3ML9odJJtY3qA&_nc_ss=7a22e&oh=00_Af8-PIbsxpxuWpAcPkqmc9fcy_oQoyxTkLr7lRif5K2awg&oe=6A303596
DYfi_FsBrfc,https://www.instagram.com/reel/DYfi_FsBrfc/,video,2026-05-18T20:11:37.000Z,1779135097,55,1,,0.1918,"Temos que parar e curtir o momento! 🤩  🎥 No último corte deste episódio do BandCast, os Professores de Educação Física Daniela Godoi, Carlos De Simone e Paulo Godoi conversaram sobre a importância de vivenciar experiências e conquistas antes de partir para o próximo desafio.  Quer assistir ao BandCast completo? Acesse o nosso Youtube! 🔗  #BandCast #PodCastDoBand #EducaçãoFísica #ColégioBandeirantes #Colband2026",https://instagram.fcgh9-1.fna.fbcdn.net/v/t51.71878-15/702404185_1883858982294089_3024223763554000652_n.jpg?stp=dst-jpg_e15_tt6&_nc_cat=103&ig_cache_key=Mzg5OTk4OTY3MTM0MTg5NzY5Mg%3D%3D.3-ccb7-5&ccb=7-5&_nc_sid=58cdad&efg=eyJ2ZW5jb2RlX3RhZyI6IkNMSVBTLnhwaWRzLjY0MC5zZHIudmlkZW9fbmZyYW1lX2NvdmVyX2ZyYW1lLkMzIn0%3D&_nc_ohc=uwDSFpalnOcQ7kNvwF6a7zE&_nc_oc=AdrHqU6aCc4R1p2Wt6pmI0LMAw4KAHyjd-SREnFRtNiXeOc_x74p0DUXiW9uxyt9oxZGomBAiXwesrSB9vN3IOnb&_nc_ad=z-m&_nc_cid=0&_nc_zt=23&_nc_ht=instagram.fcgh9-1.fna&_nc_gid=qiA_AZGOJ3ML9odJJtY3qA&_nc_ss=7a22e&oh=00_Af82hD4PtpKb90nApX7EiskkfTXkFiXTccR0yW1PSaj6KA&oe=6A3003DA
DYfbu8_lOza,https://www.instagram.com/p/DYfbu8_lOza/,carousel,2026-05-18T19:06:57.000Z,1779131217,102,1,,0.3528,"Na última sexta-feira, tivemos nosso Coletivo das Meninas voltado às alunas dos 8ºs e 9ºs anos. Desta vez, o protagonismo ficou por conta das meninas do Girl Up, grupo de meninas do Ensino Médio do Colégio, que preparou uma reflexão a partir de histórias da Disney que, em um olhar mais atento, revelam silenciamento, opressão, rivalidade feminina, estereótipos, padrões estéticos, entre outros temas presentes na nossa sociedade.  Foi um tempo de troca, intimidade e muita aprendizagem!  Bora pensar em mais parceiras, @gu.colband !?Adoramos! #ProtagonismoJuvenil  #convivênciaética  #empoderamentofeminino #sororidade",https://instagram.fcgh9-1.fna.fbcdn.net/v/t51.82787-15/702569032_18163047595449074_9120563579874868609_n.webp?_nc_cat=106&ig_cache_key=Mzg5OTk1NjA4MjY5Mjg0MDExNw%3D%3D.3-ccb7-5&ccb=7-5&_nc_sid=58cdad&efg=eyJ2ZW5jb2RlX3RhZyI6IkNBUk9VU0VMX0lURU0ueHBpZHMuNDA4MC5zZHIucmVndWxhcl9waG90by5DMyJ9&_nc_ohc=u1kbYo8c-_gQ7kNvwFCEN-c&_nc_oc=AdqAsxfch5B1sCYDmf1qPRKzFpbMFnsP4hLi_8QfKzHuMqJGRwx_4qg3aDDZY4geR8J9w7nhVKwgizp_QL8QDQRo&_nc_ad=z-m&_nc_cid=0&_nc_zt=23&_nc_ht=instagram.fcgh9-1.fna&_nc_gid=qiA_AZGOJ3ML9odJJtY3qA&_nc_ss=7a22e&oh=00_Af8ToQ-fPtWjuC-f3OQqDbS7sybiRaxdhzYq_7V46CQH8w&oe=6A3033D3
DYXwvAZlf5v,https://www.instagram.com/p/DYXwvAZlf5v/,carousel,2026-05-15T19:36:32.000Z,1778873792,143,4,,0.5036,"🌎 Entre os dias 10 e 15 de maio, o nosso Coordenador do Internacional, Olavo Amorim, participou do The Higher Education / BMI International Global Forum, em Portugal. 🇵🇹  O evento reuniu counselors de mais de 50 países para trocar conhecimentos com universidades do mundo todo, incluindo sessões de formação e visitas.  O fórum também é um momento de celebração! Ao acompanhar a entrega dos prêmios deste ano, Olavo reviveu a emoção de 2024, quando foi homenageado com o Lifetime Achievement in Counseling Award. ✨  #BandCosmopolita  #TheHigherEducation  #StudyAbroad  #InternacionalColband #Colband2026",https://instagram.fcgh9-1.fna.fbcdn.net/v/t51.82787-15/696149635_18587285620052885_7081253783875822691_n.jpg?stp=dst-jpg_e35_tt6&_nc_cat=103&ig_cache_key=Mzg5Nzc5ODA0MDgzMjQzNDI3NA%3D%3D.3-ccb7-5&ccb=7-5&_nc_sid=58cdad&efg=eyJ2ZW5jb2RlX3RhZyI6IkNBUk9VU0VMX0lURU0ueHBpZHMuMTA4MC5zZHIucmVndWxhcl9waG90by5DMyJ9&_nc_ohc=1gbm6dm_lZkQ7kNvwGm6AdG&_nc_oc=AdqRa94i1KfX1XjXEg4YL7l83twbF0LzYPmMipCEQlzn0B-nEUa74y-Pdk0jPcRekp30I2IR8tvfPZ0fjIMwnA7c&_nc_ad=z-m&_nc_cid=0&_nc_zt=23&_nc_ht=instagram.fcgh9-1.fna&_nc_gid=CCHaUwo9VHVTCASQBqbcxQ&_nc_ss=7a22e&oh=00_Af9B7N7h3KzuLx8VPgZr5HmzWmydmsbplPEcUhOlpJ-ZUg&oe=6A3032B6
DYXozI9ldtW,https://www.instagram.com/p/DYXozI9ldtW/,carousel,2026-05-15T18:27:12.000Z,1778869632,78,0,,0.2672,"🌍 Semana intensa no Band Cosmopolita!  Recebemos especialistas e universidades de diferentes partes do mundo para conversar com nossos alunos sobre possibilidades acadêmicas internacionais e diferentes caminhos de formação global. 🇬🇧🇺🇸🇪🇸  ✨ Tivemos um expert em admissões e opções de estudo no Reino Unido, além das visitas de:  🇺🇸 Pomona College 🇺🇸 Bowdoin College 🇺🇸 Williams College 🇪🇸 IE University  #BandCosmopolita  #CollegeCounseling  #StudyAbroad  #InternacionalColband #Colband2026",https://instagram.fcgh9-1.fna.fbcdn.net/v/t51.82787-15/695870702_18587267821052885_5873910176087147838_n.jpg?stp=dst-jpg_e35_tt6&_nc_cat=111&ig_cache_key=Mzg5Nzc2MjY0ODAxMTc3MTQ2OA%3D%3D.3-ccb7-5&ccb=7-5&_nc_sid=58cdad&efg=eyJ2ZW5jb2RlX3RhZyI6IkNBUk9VU0VMX0lURU0ueHBpZHMuMTA4MC5zZHIucmVndWxhcl9waG90by5DMyJ9&_nc_ohc=R5mgzpZgO-kQ7kNvwFfUoYp&_nc_oc=Adq48yr-ABrE0-dviIk1l7DVXHCgTIC6-ExYiw1WavVD1qevNbTD4XjEYwtOoKOrNDDjdhomUPvTc8dD110CTn76&_nc_ad=z-m&_nc_cid=0&_nc_zt=23&_nc_ht=instagram.fcgh9-1.fna&_nc_gid=CCHaUwo9VHVTCASQBqbcxQ&_nc_ss=7a22e&oh=00_Af97ooKQ_pgdFOuIz1uPZuuOW8jT5-VP9U2lvwBB_UnwqQ&oe=6A3023FD
DYXi_VoFX7E,https://www.instagram.com/p/DYXi_VoFX7E/,carousel,2026-05-15T17:36:26.000Z,1778866586,106,4,,0.3768,"Abril é o Mês de Conscientização e Combate ao Bullying e à Violência Escolar. Pensando nisso, a CCA realizou três ações ao longo do mês que reforçam seu compromisso em promover um ambiente cada vez mais consciente e empático. Foram elas:  ✔️ Cartazes com autorretratos desenhados pelos alunos, que expressaram a própria identidade, ✔️ Apresentação do grupo de cultura de hip hop e educação, Matéria Rima, ✔️ Oficina sobre bullying para as famílias, conduzida pelos membros da CCA.  Essas iniciativas propuseram reflexões entre a comunidade Band sobre bullying, empatia e diversidade! 🩵💙  Leia a matéria completa no site do Band. ➡️💻  #CCA #CCAColband",https://instagram.fcgh9-1.fna.fbcdn.net/v/t51.82787-15/700155115_18587257042052885_403963273210882684_n.jpg?stp=dst-jpg_e35_tt6&_nc_cat=110&ig_cache_key=Mzg5NzczNjc2MjA3NjE1MzU5NQ%3D%3D.3-ccb7-5&ccb=7-5&_nc_sid=58cdad&efg=eyJ2ZW5jb2RlX3RhZyI6IkNBUk9VU0VMX0lURU0ueHBpZHMuMTA4MC5zZHIucmVndWxhcl9waG90by5DMyJ9&_nc_ohc=DSIozPSbXzAQ7kNvwGRsBWA&_nc_oc=AdoEGNV5jYP_tqXY9nGk21vcvbJeayo4YG59M8QBj8btx2dJdUyL7wML8vt_ueQzIlyMp7G-ob1lX-MSe2LB-ELd&_nc_ad=z-m&_nc_cid=0&_nc_zt=23&_nc_ht=instagram.fcgh9-1.fna&_nc_gid=CCHaUwo9VHVTCASQBqbcxQ&_nc_ss=7a22e&oh=00_Af9c-fGc4M84Yw693uLj6dMPIKxXVKKJLms1wdGdC0yHfw&oe=6A301B97
DYXDFwsh4g-,https://www.instagram.com/reel/DYXDFwsh4g-/,video,2026-05-15T12:59:29.000Z,1778849969,130,5,,0.4625,"Missão dada é missão cumprida! 🤩✨  🔍 Os nossos detetives mirins do 1.o ano do Fund I aceitaram um grande desafio: desvendar a identidade de uma pessoa misteriosa.   🫆Para chegar ao objetivo final, eles precisaram encontrar pistas e decifrar enigmas com base em características que nos tornam únicos, como impressões digitais, DNA, íris e até fio de cabelo!   🎥 Eles puderam aprender de forma divertida, explorando diversos espaços do Band. Quer saber quem era a pessoa misteriosa? Assista o vídeo até o final!  #DetetivesMirins  #Escape  #FundIColband  #ColégioBandeirantes  #Colband2026",https://instagram.fcgh9-1.fna.fbcdn.net/v/t51.82787-15/700907011_18587185195052885_200970644442086615_n.jpg?stp=dst-jpg_e15_tt6&_nc_cat=104&ig_cache_key=Mzg5NzU5NzU5MjUzNjA1NzkxODE4NTg3MTg1MTg5MDUyODg1.3-ccb7-5&ccb=7-5&_nc_sid=58cdad&efg=eyJ2ZW5jb2RlX3RhZyI6IkNMSVBTLnhwaWRzLjcyMC5zZHIudmlkZW9fZGVmYXVsdF9jb3Zlcl9mcmFtZS5DMyJ9&_nc_ohc=XziE94qDQHkQ7kNvwF4VHvx&_nc_oc=AdrThRRQuiPAus9-xMuStV4t6vyLgEgybBpcBZ4-u1snLzz977GaYWcjDSNmdoG_yLKyKNEnFSk7m9yLc8qdnyjV&_nc_ad=z-m&_nc_cid=0&_nc_zt=23&_nc_ht=instagram.fcgh9-1.fna&_nc_gid=CCHaUwo9VHVTCASQBqbcxQ&_nc_ss=7a22e&oh=00_Af_15-YDNfQaLjmVKPhnQkXGGrcBQS5fCJ-P9VzpTBpzoA&oe=6A301FAB
DYU-8jiBugm,https://www.instagram.com/reel/DYU-8jiBugm/,video,2026-05-14T17:44:52.000Z,1778780692,105,5,,0.3768,"🗣️ O mais recente encontro da Comissão de Marketing do Educational Leaders, grupo que reúne líderes de marketing de colégios de todo Brasil, levantou um debate essencial: o antirracismo nas escolas.  Presidido por Ricardo Aguirre, Head de Marketing do Band, o grupo recebeu Leo Bento, do Instituto Inaperê, para discutir os impactos dessa pauta na cultura, na formação dos alunos e na imagem das instituições.   🎥 Assista ao vídeo e confira alguns dos pontos centrais que foram discutidos nesse encontro, que reforçou a urgência de construir escolas mais coerentes, humanas e preparadas para um mundo cosmopolita.  @inapereconsultoria  @educationalleadersbr  @schooladvisorbr   #Inaperê  #AntirracismoNasEscolas #EducationalLeaders  #ColégioBandeirantes  #Colband2026",https://instagram.fcgh9-1.fna.fbcdn.net/v/t51.71878-15/696242675_1048392168365007_3488267061184773483_n.jpg?stp=dst-jpg_e15_tt6&_nc_cat=102&ig_cache_key=Mzg5NzAxNjQxNzc4NjQ1NjEwMg%3D%3D.3-ccb7-5&ccb=7-5&_nc_sid=58cdad&efg=eyJ2ZW5jb2RlX3RhZyI6IkNMSVBTLnhwaWRzLjY0MC5zZHIudmlkZW9fbmZyYW1lX2NvdmVyX2ZyYW1lLkMzIn0%3D&_nc_ohc=KOIzqgiyAxEQ7kNvwF6JSNe&_nc_oc=AdrHH0FwmrFpVi9eH1NUPWh7Z6FMwef-Qkw1uop_jRRhNPECXMJl3sqMBORzzPEDBAX5hzUqaUrQ-jVe80DQrUK7&_nc_ad=z-m&_nc_cid=0&_nc_zt=23&_nc_ht=instagram.fcgh9-1.fna&_nc_gid=CCHaUwo9VHVTCASQBqbcxQ&_nc_ss=7a22e&oh=00_Af-vXILOiuPgP45kMw7b9_XP5WAwSHYl_-YYh5tpTqdTqA&oe=6A3023F6
DYUmEAcFccf,https://www.instagram.com/p/DYUmEAcFccf/,carousel,2026-05-14T14:05:34.000Z,1778767534,219,1,,0.7536,"Ciência na prática! 💡  ➡️ Os alunos do 8.o ano adentraram o estudo de circuitos elétricos em uma aula muito especial. Em parceria com o Departamento de Física do Ensino Médio, os professores de Ciências organizaram atividades interativas com a placa de circuitos, aproximando os estudantes de experiências e discussões típicas das aulas da 3.a série.  ➡️ Na prática, eles puderam observar as características das associações em série e em paralelo, além de compreender o funcionamento do curto-circuito. A atividade também foi uma oportunidade para os alunos do Fund II terem contato com especialistas da área e aprofundarem ainda mais os conteúdos trabalhados em sala.  ➡️ Um primeiro passo para conceitos que continuarão sendo explorados e aprofundados ao longo da trajetória no Band!  #CiênciaNaPrática #CircuitosElétricos  #FísicaColband #ColégioBandeirantes #Colband2026",https://instagram.fcgh9-1.fna.fbcdn.net/v/t51.82787-15/694941269_18586923127052885_6932356506389523197_n.jpg?stp=dst-jpg_e35_tt6&_nc_cat=108&ig_cache_key=Mzg5NjkwNjI3MDgzMzQ0OTE3Nw%3D%3D.3-ccb7-5&ccb=7-5&_nc_sid=58cdad&efg=eyJ2ZW5jb2RlX3RhZyI6IkNBUk9VU0VMX0lURU0ueHBpZHMuMTA4MC5zZHIucmVndWxhcl9waG90by5DMyJ9&_nc_ohc=MZubxAkoJcgQ7kNvwGYSybX&_nc_oc=AdrLtf5zLNbdkCts4ONd42NXHjJgl4_2ViSpkMgGVcglVPofCrjzJl-JnX39Hgq4e3a3JhtNjJbNJnQs4kPNTcpN&_nc_ad=z-m&_nc_cid=0&_nc_zt=23&_nc_ht=instagram.fcgh9-1.fna&_nc_gid=CCHaUwo9VHVTCASQBqbcxQ&_nc_ss=7a22e&oh=00_Af95pmlssYClgqo8L7OjeKKfWeiPwIC1_lpM4eVUJViNZw&oe=6A301297
DYSinz8hCVU,https://www.instagram.com/reel/DYSinz8hCVU/,video,2026-05-13T19:01:19.000Z,1778698879,30,1,,0.1062,"Todo o aprendizado da professora Daniela Godoi em seu mestrado e doutorado trouxe retornos valiosos ao Band! 🅱️   Seja por meio de palestras sobre TDAH (Transtorno do Déficit de Atenção com Hiperatividade), TDC (Transtorno do Desenvolvimento da Coordenação) e TEA (Transtorno do Espectro Autista), seja por meio de práticas que adaptam as aulas de Educação Física, esse conhecimento impacta positivamente toda a comunidade escolar.  Não perca os próximos cortes! 🎥  #BandCast #PodCastDoBand #EducaçãoFísica #ColégioBandeirantes #Colband2026",https://instagram.fcgh9-1.fna.fbcdn.net/v/t51.82787-15/689540117_18586720054052885_7698250503796310543_n.jpg?stp=dst-jpg_e15_tt6&_nc_cat=100&ig_cache_key=Mzg5NjMyODg5NzA0NTk5Njg4NDE4NTg2NzIwMDUxMDUyODg1.3-ccb7-5&ccb=7-5&_nc_sid=58cdad&efg=eyJ2ZW5jb2RlX3RhZyI6IkNMSVBTLnhwaWRzLjcyMC5zZHIudmlkZW9fZGVmYXVsdF9jb3Zlcl9mcmFtZS5DMyJ9&_nc_ohc=R5z85G3tLagQ7kNvwFvyuBZ&_nc_oc=AdoZKQThVAdyrYIZBMot3ycfb7053HNOjnAfMrX69P3ZFJ5jsOO-S6eAWCefUasODESxhcx-L-xEgU_oyye3OwHZ&_nc_ad=z-m&_nc_cid=0&_nc_zt=23&_nc_ht=instagram.fcgh9-1.fna&_nc_gid=CCHaUwo9VHVTCASQBqbcxQ&_nc_ss=7a22e&oh=00_Af_Y7wVgA3WUuplJUAjF4laOzS-rY8gDbVXAY0iNwYMgEA&oe=6A302BF3
DYSFTrCh81H,https://www.instagram.com/reel/DYSFTrCh81H/,video,2026-05-13T14:42:19.000Z,1778683339,498,58,,1.9046,"A experiência do Ensino Médio no Band combina alta performance acadêmica com suporte emocional! 🅱️  Nossa preparação para o vestibular conta com eletivas e itinerários diversos, simulados e trilhas de cada área do conhecimento. Além disso, oferecemos um olhar atento aos alunos com os Departamentos de Futuro e Carreiras e Internacional, que proporcionam um atendimento individualizado. 🌎🎓  Quer fazer parte de tudo isso? 🤩  📆 As inscrições para o Vestibulinho da 1.a série, que acontecerá no dia 17 de outubro, já estão abertas!  #Matrículas  #AnoLetivo2027  #AlunosNovos  #ColégioBandeirantes  #Colband2026",https://instagram.fcgh9-1.fna.fbcdn.net/v/t51.82787-15/689612375_18586672102052885_2744212128610048994_n.jpg?stp=dst-jpg_e15_tt6&_nc_cat=104&ig_cache_key=Mzg5NjE5OTk2OTc0NDg2NjYzMTE4NTg2NjcyMDk2MDUyODg1.3-ccb7-5&ccb=7-5&_nc_sid=58cdad&efg=eyJ2ZW5jb2RlX3RhZyI6IkNMSVBTLnhwaWRzLjcyMC5zZHIudmlkZW9fZGVmYXVsdF9jb3Zlcl9mcmFtZS5DMyJ9&_nc_ohc=SWgGiVDXdjUQ7kNvwH6v1id&_nc_oc=AdrYxpefs6kCjzVWJ7IO6k-Q0OtM0Gva2eWLOUJTsgdqQ5DHT9Qq0b8L-WdDYgbhEw_f1WPisv1rA_xk0MWMVn7d&_nc_ad=z-m&_nc_cid=0&_nc_zt=23&_nc_ht=instagram.fcgh9-1.fna&_nc_gid=CCHaUwo9VHVTCASQBqbcxQ&_nc_ss=7a22e&oh=00_Af_pA_K5L_ixdXDpWdBr5Y6mIZqtFZf9h6Yet_oVEEZ98w&oe=6A3013F1
DYSESHVlUv1,https://www.instagram.com/p/DYSESHVlUv1/,carousel,2026-05-13T14:31:55.000Z,1778682715,176,2,,0.6098,"Aprender na prática faz toda a diferença! 💛  As turmas do 2.o ano do Fund I visitaram o Viveiro Manequinho Lopes no Parque do Ibirapuera para investigar e aprofundar seus conhecimentos sobre as plantas.   Entre observações, curiosidades e novas perguntas, as crianças conheceram diferentes espécies e aprenderam mais sobre sua importância para o meio ambiente.   A experiência, vinculada ao componente Ciências da Natureza, ampliou o contato com a diversidade das plantas e reforçou atitudes de cuidado e respeito pela natureza.  #ViveiroManequinhoLopes  #ParqueDoIbirapuera  #CiênciasDaNatureza #FundIColband #Colband2026",https://instagram.fcgh9-1.fna.fbcdn.net/v/t51.82787-15/694973845_18586659799052885_227550785672360435_n.jpg?stp=dst-jpg_e35_tt6&_nc_cat=105&ig_cache_key=Mzg5NjE5MjI5MTM0OTg5NTYwOQ%3D%3D.3-ccb7-5&ccb=7-5&_nc_sid=58cdad&efg=eyJ2ZW5jb2RlX3RhZyI6IkNBUk9VU0VMX0lURU0ueHBpZHMuMTA4MC5zZHIucmVndWxhcl9waG90by5DMyJ9&_nc_ohc=fRTHZog9S8EQ7kNvwG1dqkx&_nc_oc=Adpa_pPEfakN0RaixEuk4X_Ssp3K2XxMPgfwQsHuAfAI5rW4gE9d8K5hgB9uz4R2jSfyPrQhvZitu3xUR3QiUwYL&_nc_ad=z-m&_nc_cid=0&_nc_zt=23&_nc_ht=instagram.fcgh9-1.fna&_nc_gid=CCHaUwo9VHVTCASQBqbcxQ&_nc_ss=7a22e&oh=00_Af9axJbGe3ZOSwGD1pj9HdVJT2-_qnHHWfOsGjxdYZIBzQ&oe=6A300A78
